Nome da Música;Artistas;ID da Música
As I Am (feat. Khalid);";";"Justin Bieber; Khalid";";";5RE1BlC2bVRL02T0wcLq2X
Holy (feat. Chance The Rapper);";";"Justin Bieber; Chance the Rapper";";";2HFHwTr1IBWheGoQtNNKtx
Unstable (feat. The Kid LAROI);";";"Justin Bieber; The Kid LAROI";";";7K5ASMnqnCR42bJBJ3GAVz
Die For You (feat. Dominic Fike);";";"Justin Bieber; Dominic Fike";";";7enNMlrM074O02PPj5ena0
Peaches (feat. Daniel Caesar & Giveon);";";"Justin Bieber; Daniel Caesar; Giveon";";";2vxifWbsK3QiAy1vriVbNE
Love You Different (feat. BEAM);";";"Justin Bieber; BEAM";";";7knk6teYVDHhS2VZ2ea5nL
Loved By You (feat. Burna Boy);";";"Justin Bieber; Burna Boy";";";5zNjOYCjXVaEEowdRqanBg
Lonely (with benny blanco);";";"Justin Bieber; benny blanco";";";3uhWobYmvGnpN4a2LGnGQH
There She Go (feat. Lil Uzi Vert);";";"Justin Bieber; Lil Uzi Vert";";";1fWMpx0wmv2fVCHEX9MmP6
I Can't Be Myself (feat. Jaden);";";"Justin Bieber; Jaden";";";6lYxkQglLrKTc0mfTj7Esl
Wish You Would (feat. Quavo);";";"Justin Bieber; Quavo";";";5oOwrzVOUXoqUUMwWH0U71
Know No Better (feat. DaBaby);";";"Justin Bieber; DaBaby";";";7nGXisQHTmaOHpVRehSlhe
Name (feat. Tori Kelly);";";"Justin Bieber; Tori Kelly";";";15NqDX3qmiDYIRYqVNmZIB
Red Eye (feat. TroyBoi);";";"Justin Bieber; TroyBoi";";";24OeEKPQ8qqNZnPevRHxUT
Angels Speak;";";"Justin Bieber; Poo Bear";";";6mrUAKW4UA7ygQzoyekxxr
As I Am (feat. Khalid);";";"Justin Bieber; Khalid";";";5taMOY6HlxpEqUyhM1bFu2
Holy (feat. Chance The Rapper);";";"Justin Bieber; Chance the Rapper";";";6nPbYhCg1L6abGsy6bKylA
Unstable (feat. The Kid LAROI);";";"Justin Bieber; The Kid LAROI";";";3ppFZ3cYXbi0T8tUJDNx7Q
Die For You (feat. Dominic Fike);";";"Justin Bieber; Dominic Fike";";";2gBPZEtW6sxFHHa7TL4jd0
Peaches (feat. Daniel Caesar & Giveon);";";"Justin Bieber; Daniel Caesar; Giveon";";";3wKpoOfaQaxdnalXMqSPpO
Love You Different (feat. BEAM);";";"Justin Bieber; BEAM";";";0Zmkb0nqXMqpUgJQrXXHnb
Loved By You (feat. Burna Boy);";";"Justin Bieber; Burna Boy";";";3vw444I3uzqwcEryeh5Z6H
Lonely (with benny blanco);";";"Justin Bieber; benny blanco";";";3353R7ZeupOP7Rp7o94mqa
There She Go (feat. Lil Uzi Vert);";";"Justin Bieber; Lil Uzi Vert";";";7i2xVGqiF5FBPvLg6PLHX3
I Can't Be Myself (feat. Jaden);";";"Justin Bieber; Jaden";";";4C9pETarpQoI5ODtx6My41
Wish You Would (feat. Quavo);";";"Justin Bieber; Quavo";";";4pIC8i4jv9HT1CPH2aGbw3
Know No Better (feat. DaBaby);";";"Justin Bieber; DaBaby";";";6iKFUkq6GmaW4UQGED1tSd
Name (feat. Tori Kelly);";";"Justin Bieber; Tori Kelly";";";6EKDPhgCDL2cwRvloAEwSP
As I Am (feat. Khalid);";";"Justin Bieber; Khalid";";";6F2r4HgpJnvKDmkN6JEN6J
Holy (feat. Chance The Rapper);";";"Justin Bieber; Chance the Rapper";";";6Xgq7MvZiet0hVi3KaDSgJ
Unstable (feat. The Kid LAROI);";";"Justin Bieber; The Kid LAROI";";";137mSruegm1u6x9NvwiagR
Die For You (feat. Dominic Fike);";";"Justin Bieber; Dominic Fike";";";7aely3H8kMj9o0gt6vXHE1
Peaches (feat. Daniel Caesar & Giveon);";";"Justin Bieber; Daniel Caesar; Giveon";";";4iJyoBOLtHqaGxP12qzhQI
Love You Different (feat. BEAM);";";"Justin Bieber; BEAM";";";27UcQ6dAvQrgH9C880rCM3
Loved By You (feat. Burna Boy);";";"Justin Bieber; Burna Boy";";";2tB9OFgAHjAds3cqquLlvp
Lonely (with benny blanco);";";"Justin Bieber; benny blanco";";";3S8jK1mGzQi24ilFb45DAZ
Intentions (feat. Quavo);";";"Justin Bieber; Quavo";";";4umIPjkehX1r7uhmGvXiSV
Forever (feat. Post Malone & Clever);";";"Justin Bieber; Post Malone; Clever";";";2ZlCGeK30BLRNSPC832pNZ
Running Over (feat. Lil Dicky);";";"Justin Bieber; Lil Dicky";";";75nKBP8jQu681pTNCtrEnn
Second Emotion (feat. Travis Scott);";";"Justin Bieber; Travis Scott";";";1PnAx788sAvcI3ZxTlEyX8
Get Me (feat. Kehlani);";";"Justin Bieber; Kehlani";";";5VwwpU7KsLhgfbMEecedhJ
Yummy - Summer Walker Remix;";";"Justin Bieber; Summer Walker";";";2FBpJGt00G0h1q0RHuqaGO
No Pressure;";";"Justin Bieber; Big Sean";";";23UV8pJEvRnAZd6ZAXBC0H
No Sense;";";"Justin Bieber; Travis Scott";";";5L9WFUodzACitS1TiGm7Mi
The Feeling;";";"Justin Bieber; Halsey";";";7E390nZTMqEbrNC1TmHd42
Where Are Ü Now;";";"Skrillex; Diplo; Justin Bieber";";";0n8ob8S72lvznoVfiwz4qL
We Are;";";"Justin Bieber; Nas";";";1m6FkAtWVloxIRHKl7pBDP
PYD;";";"Justin Bieber; R. Kelly";";";2GxCTEXhba060skpicYxTk
Confident;";";"Justin Bieber; Chance the Rapper";";";3JsydWaf2Ev4ehaLUjj3SY
Backpack;";";"Justin Bieber; Lil Wayne";";";0jX97Hk6L8ImeVdTTWXZ2D
What's Hatnin';";";"Justin Bieber; Future";";";1p5M91qghUkzS4gwuMM22B
Memphis;";";"Justin Bieber; Big Sean";";";5qHcOrOMSznBWzR8Xy1WYZ
All Around The World;";";"Justin Bieber; Ludacris";";";1Mg8vLBYwizu7AuhYQO64V
As Long As You Love Me;";";"Justin Bieber; Big Sean";";";0pwYLVXVknPSGUQb39cePC
Right Here;";";"Justin Bieber; Drake";";";7vjtAU3Ns1AT4dRa0voHBJ
Beauty And A Beat;";";"Justin Bieber; Nicki Minaj";";";190jyVPHYjAqEaOGmMzdyk
Fairytale;";";"Justin Bieber; Jaden";";";55DEnUKIReTBcrjAmAa9Tw
All Around The World;";";"Justin Bieber; Ludacris";";";6WgrB8d7GLBGweYLDI6ObR
As Long As You Love Me;";";"Justin Bieber; Big Sean";";";75lo8VozcCLRG9WGG674iD
Right Here;";";"Justin Bieber; Drake";";";2Rmuzh89p29BeTIF63Opwo
Beauty And A Beat;";";"Justin Bieber; Nicki Minaj";";";6QFCMUUq1T2Vf5sFUXcuQ7
The Christmas Song (Chestnuts Roasting On An Open Fire);";";"Justin Bieber; USHER";";";3eYnKe0LhQA1B5HEkQaRTP
Fa La La;";";"Justin Bieber; Boyz II Men";";";5Ea0FNlMDWkraQDlfOPrDv
All I Want For Christmas Is You (SuperFestive!) Duet with Mariah Carey;";";"Justin Bieber; Mariah Carey";";";1IUtgwxLYzDVd41EgbKUjX
Drummer Boy;";";"Justin Bieber; Busta Rhymes";";";0Pd4lsvSDPkcNCxbcz0UeV
Home This Christmas;";";"Justin Bieber; The Band Perry";";";192yj763UcVbfyxFrVmIac
Fa La La - A Cappella;";";"Justin Bieber; Boyz II Men";";";60lFlh6OL0BKHxGEAoyVp7
The Christmas Song (Chestnuts Roasting On An Open Fire);";";"Justin Bieber; USHER";";";2X3ibsXEeZ6cJdRRKJPoqO
Fa La La;";";"Justin Bieber; Boyz II Men";";";5kq3YD407av1s3ZHMaZIGv
All I Want For Christmas Is You (SuperFestive!) Duet with Mariah Carey;";";"Justin Bieber; Mariah Carey";";";4EUKThOTPBkrAH0gggkMn4
Drummer Boy;";";"Justin Bieber; Busta Rhymes";";";27hP4HbyklO2Puv0e1Am8T
Home This Christmas;";";"Justin Bieber; The Band Perry";";";1lUYap3IVPOLZTAq8828F6
Never Say Never;";";"Justin Bieber; Jaden";";";5GYbkDveRD2I8M5ZJ14hWn
That Should Be Me;";";"Justin Bieber; Rascal Flatts";";";42wmRq3kfUUuyszlkWQbPS
Somebody To Love Remix;";";"Justin Bieber; USHER";";";7IUl5c6u18rzmyQOblj10T
Up;";";"Justin Bieber; Chris Brown";";";0NLaJkNWZARgae0ojQOOvi
Overboard (Live);";";"Justin Bieber; Miley Cyrus";";";5h4Z1fyzlAZhGPRaQz7ima
Runaway Love - Kanye West Remix;";";"Justin Bieber; Raekwon";";";0esMJjir6P5YsfQinJANmm
First Dance;";";"Justin Bieber; USHER";";";45yBkrYHYlK5ipruB8glpG
Baby;";";"Justin Bieber; Ludacris";";";0VNDOpBbUYtSpCFY7HUA3D
Overboard;";";"Justin Bieber; Jessica Jarrell";";";0GX9k4ni4IDqU1vRHVPmiw
Eenie Meenie;";";"Justin Bieber; Sean Kingston";";";7BRsgzIz8C0VdAqANIjUhC
Baby;";";"Justin Bieber; Ludacris";";";6epn3r7S14KUqlReYr77hA
Overboard;";";"Justin Bieber; Jessica Jarrell";";";1tzkJMX3gNjnpcHdLD0pM3
Eenie Meenie;";";"Justin Bieber; Sean Kingston";";";75vEuMA15pb8JmgrGugHEs
First Dance;";";"Justin Bieber; USHER";";";4bPeekGfzuqkmlpKiJur5o
Snooze (Acoustic) (feat. Justin Bieber);";";"SZA; Justin Bieber";";";5YABYtKx9qa56vBjlXDbmw
Private Landing (feat. Justin Bieber & Future);";";"Don Toliver; Justin Bieber; Future";";";4EDTT4kSqfpc0FKuxfNo2E
Honest (feat. Don Toliver);";";"Justin Bieber; Don Toliver";";";2KdKh9vHbKW0tZLqtpxxI0
up at night (feat. justin bieber);";";"Kehlani; Justin Bieber";";";4WghJOMjDpGdlk3b8aJIgy
attention (with Justin Bieber);";";"Omah Lay; Justin Bieber";";";6tTeRmhhuwDl5Y4UiJdHuO
lonely christmas (feat. Justin Bieber & Poo Bear);";";"Bryson Tiller; Justin Bieber; Poo Bear";";";2TB7t45lVP3l5DyVVX0goz
Don’t Go (with Justin Bieber & Don Toliver);";";"Skrillex; Justin Bieber; Don Toliver";";";55sgQENF3LY1sUcJUwasLl
Essence (feat. Justin Bieber & Tems);";";"Wizkid; Justin Bieber; Tems";";";1mSdbey7RstGLY2udgXv74
STAY (with Justin Bieber);";";"The Kid LAROI; Justin Bieber";";";5HCyWlXZPP0y6Gqq8TgA20
Peaches (Masterkraft Remix) feat. Alpha P & Omah Lay;";";"Justin Bieber; Alpha P; Omah Lay; Masterkraft";";";6lUpRCvUGvAymNGJzVywN8
Peaches (Remix) feat. Ludacris, Usher & Snoop Dogg;";";"Justin Bieber; USHER; Snoop Dogg; Ludacris";";";5E75Cr0oqxGoX0YYwdC3nZ
Freedom (with BEAM);";";"Justin Bieber; BEAM";";";6TQeWWQMtSWFNgR7yxvcg6
All She Wrote (feat. Brandon Love & Chandler Moore);";";"Justin Bieber; Brandon Love; Chandler Moore";";";4J8JsvGToawvjyVL482UqH
Where You Go I Follow (feat. Pink Sweat$, Chandler Moore & Judah Smith);";";"Justin Bieber; Pink Sweat$; Chandler Moore; Judah Smith";";";4XeDTAfStwoOLB2NjCrRMA
Where Do I Fit In (feat. Tori Kelly, Chandler Moore & Judah Smith);";";"Justin Bieber; Tori Kelly; Chandler Moore; Judah Smith";";";6YY78QaJxC3DLQzanXQRnl
Afraid To Say (feat. Lauren Walters);";";"Justin Bieber; Lauren Walters";";";6SLCa0j1sDc3CWTYCxbK0U
Monster (Shawn Mendes & Justin Bieber);";";"Shawn Mendes; Justin Bieber";";";2Z8yfpFX0ZMavHkcIeHiO1
Mood (Remix) feat. Justin Bieber, J Balvin & iann dior;";";"24kGoldn; Justin Bieber; J Balvin; iann dior";";";6FuGJB290AQMAHTfjOYVaK
Holy - Acoustic;";";"Justin Bieber; Chance the Rapper";";";6gcQJ6W4H89xkQFm63gcsB
Lonely (with benny blanco);";";"Justin Bieber; benny blanco";";";4MyOniEgBnVt8bYFHyTEDl
Lonely (with benny blanco) - Acoustic;";";"Justin Bieber; benny blanco";";";4fKiuIavbsoTRZ6R7xuAyT
Lonely (with benny blanco);";";"Justin Bieber; benny blanco";";";4y4spB9m0Q6026KfkAvy9Q
Holy (feat. Chance The Rapper);";";"Justin Bieber; Chance the Rapper";";";5u1n1kITHCxxp8twBcZxWy
Stuck with U (with Justin Bieber);";";"Ariana Grande; Justin Bieber";";";4HBZA5flZLE435QTztThqH
Yummy - Country Remix;";";"Justin Bieber; Florida Georgia Line";";";18190jS9db6xIkdt6HkgXj
Intentions;";";"Justin Bieber; Quavo";";";364dI1bYnvamSnBJ8JcNzN
Yummy - Summer Walker Remix;";";"Justin Bieber; Summer Walker";";";6M29LpV14p1pGJZbkLqDdb
Get Me;";";"Justin Bieber; Kehlani";";";6zGPytJiZmFuyVq7RTNO9G
10,000 Hours (with Justin Bieber) - Piano;";";"Dan + Shay; Justin Bieber";";";6HjF1gzVEZMb4GplnGl9B3
10,000 Hours (with Justin Bieber);";";"Dan + Shay; Justin Bieber";";";2wrJq5XKLnmhRXHIAf9xBa
bad guy (with Justin Bieber);";";"Billie Eilish; Justin Bieber";";";3yNZ5r3LKfdmjoS3gkhUCT
I Don't Care (with Justin Bieber) - Chronixx & Koffee Remix;";";"Ed Sheeran; Justin Bieber; Chronixx; Koffee";";";2Xqm0jHnkvjzrkkVRInzUB
I Don't Care (with Justin Bieber) - Loud Luxury Remix;";";"Ed Sheeran; Justin Bieber; Loud Luxury";";";6f807x0ima9a1j3VPbc7VN
