Nome da Música;Artistas;ID da Música
Think Of Us;";";"The Chainsmokers; GRACEY";";";4jpNmNXMzO3aVgJhy8sdxL
See You Again;";";"The Chainsmokers; ILLENIUM; Carlie Hanson";";";1tKUFSLuJCSlzBXm2l4HRo
Jungle;";";"Alok; The Chainsmokers; Mae Stephens";";";5W819K2wS39Bvlyh1GER5Q
Self Destruction Mode;";";"The Chainsmokers; bludnymph";";";2bUEPDiGO5iGxgkiDo7OPF
Up & Down;";";"The Chainsmokers; 347aidan";";";6YZZvbeTNUmNDxrMnNZMg1
My Bad;";";"The Chainsmokers; Shenseea";";";5ZsaCdte7URxwAy4PWHLM4
Celular;";";"Nicky Jam; Maluma; The Chainsmokers";";";6PIkKoMjo76f7Q2PrhAGu9
The Fall;";";"The Chainsmokers; Ship Wrek";";";5FvGI8KtImlEbOsvEW3pfX
Why Can't You Wait;";";"The Chainsmokers; Bob Moses";";";09EVL34Hr8e1jzFF5Hjb0v
The Reaper;";";"The Chainsmokers; Amy Shark";";";0g8Dq6OpSmWengqtLrVr77
Family;";";"The Chainsmokers; Kygo";";";3TKpJrY9q49Mj1JOsM9zGL
See The Way;";";"The Chainsmokers; Sabrina Claudio";";";6VWz99969QmNc2gWo21ktl
P.S. I Hope You're Happy;";";"The Chainsmokers; blink-182";";";5GemR0Lr9CEUJVH14mAsDO
Takeaway;";";"The Chainsmokers; ILLENIUM; Lennon Stella";";";3g0mEQx3NTanacLseoP0Gw
Call You Mine;";";"The Chainsmokers; Bebe Rexha";";";2oejEp50ZzPuQTQ6v54Evp
Do You Mean;";";"The Chainsmokers; Ty Dolla $ign; bülow";";";5vDCp6yZAikAoJ6NOEEFdp
Who Do You Love;";";"The Chainsmokers; 5 Seconds of Summer";";";2fVHrSxsQbJUuj9MW9zG1e
This Feeling;";";"The Chainsmokers; Kelsea Ballerini";";";4NBTZtAt1F13VvlSKe6KTl
Hope;";";"The Chainsmokers; Winona Oak";";";4BiiOzZCrXEzHRLYcYFiD5
Somebody;";";"The Chainsmokers; Drew Love";";";0fTiDOXRNEN0lUeYGoSHml
Side Effects;";";"The Chainsmokers; Emily Warren";";";0bGLvHd0ApdT4t0shCfpzG
Siren;";";"The Chainsmokers; Aazar";";";3K01yfjGY0NslZrXkWVAtK
Save Yourself;";";"The Chainsmokers; NGHTMRE";";";27i7Afdxq40V7qCqHnRTt6
Don't Say;";";"The Chainsmokers; Emily Warren";";";1pJQAHpD51J7GYaFrrFO9S
Something Just Like This;";";"The Chainsmokers; Coldplay";";";6RUKPb4LETWmmr3iAEQktW
My Type;";";"The Chainsmokers; Emily Warren";";";6V9kwssTrwkKT72imgowj9
It Won't Kill Ya;";";"The Chainsmokers; Louane";";";5xhJmd0I15jFcEdqxfCzKk
Wake Up Alone;";";"The Chainsmokers; Jhené Aiko";";";0dj1CtyRxZ4bnIT4Q20jNT
Last Day Alive;";";"The Chainsmokers; Florida Georgia Line";";";6GeD5g9vZTz25Egf8kxoIY
fault in the stars;";";"Powfu; The Chainsmokers";";";585DJiJ7LPSNBSUEE4TxNo
Jungle;";";"Alok; The Chainsmokers; Mae Stephens";";";0OvO2X2Q3i98dc5RcgEN3x
My Bad;";";"The Chainsmokers; Shenseea";";";0YQ0N57Whq3vgF7bqUNDHs
Celular;";";"Nicky Jam; Maluma; The Chainsmokers";";";0LUG9jzDNXcIdIWeSx9g2C
See You Again;";";"The Chainsmokers; ILLENIUM; Carlie Hanson";";";1wYTR3Hg5rBQcdfxGEdsx0
Self Destruction Mode;";";"The Chainsmokers; bludnymph";";";05e1CoIPmXLy6aPBotZlTZ
Up & Down;";";"The Chainsmokers; 347aidan";";";2R7xKsStJ9hNeZKoD9W5Nv
Make Me Feel;";";"The Chainsmokers; Cheyenne Giles";";";2i6FWcstV4Ct72L4ORnfwZ
Wish on an Eyelash, Pt. 2;";";"Mallrat; The Chainsmokers";";";10yYDp1Lnac8zEIYiCk1sp
Why Can't You Wait - 3LAU Remix;";";"The Chainsmokers; Bob Moses; 3LAU";";";6KXmKsgyW8EtRHlMk1ehKi
iPad - Frank Walker Remix;";";"The Chainsmokers; Frank Walker";";";7iq8PFNFGvsBgAD4Mcx737
iPad - Codeko Remix;";";"The Chainsmokers; Codeko";";";5iBCglZYwQ2ChJihhhUNjj
iPad - Karim Naas Remix;";";"The Chainsmokers; Karim Naas";";";3tRvN7NMVzNJv75T0xSB4v
High - Don Diablo Remix;";";"The Chainsmokers; Don Diablo";";";3aRgEzOGGGKa3XPxt9SjF8
High - Crankdat Remix;";";"The Chainsmokers; Crankdat";";";12xP1mvjsvxpBCaHIUm0qP
High - Leondis Remix;";";"The Chainsmokers; Leondis";";";1rBqcBbtMugXyuwexGNyPp
High - BADDIES ONLY Remix;";";"The Chainsmokers; BADDIES ONLY";";";76dI5yWSYniFgrUHbKJch5
High - STAR SEED Remix;";";"The Chainsmokers; STAR SEED";";";3aIApGttWTmpfuubGiaiv2
High - Don Diablo Remix;";";"The Chainsmokers; Don Diablo";";";6c2NgGHj1PxDhpkbx4d5nO
Family - Frank Walker Remix;";";"The Chainsmokers; Kygo; Frank Walker";";";6YnkswUQX2GXOhywMsBDqp
Family - Dirty Audio Remix;";";"The Chainsmokers; Kygo; Dirty Audio";";";7CqkRU4p7zTfqihXvhdbp6
Push My Luck - TWINSICK Remix;";";"The Chainsmokers; TWINSICK";";";3ZZsXOWpbJsWUWRF4ASfdf
Push My Luck - Famba Remix;";";"The Chainsmokers; Famba";";";1ywuaylLSmjHXsZOr0CY9U
Push My Luck - Ares Carter Remix;";";"The Chainsmokers; Ares Carter";";";5hxaAP30zqOqw5tbnNkZc2
Takeaway (feat. Lennon Stella) - Andrew Rayel Remix;";";"The Chainsmokers; ILLENIUM; Lennon Stella; Andrew Rayel";";";16QhpULFOW9fE2yvXsJV6A
Takeaway (feat. Lennon Stella) - Sondr Remix;";";"The Chainsmokers; ILLENIUM; Lennon Stella; Sondr";";";3DVc4VCjFaBAZF9OFquQqV
Takeaway (feat. Lennon Stella) - Ship Wrek Remix;";";"The Chainsmokers; ILLENIUM; Lennon Stella; Ship Wrek";";";13nC6hGXl0rH8YQ5TMShNF
Takeaway (feat. Lennon Stella) - Pilton Remix;";";"The Chainsmokers; ILLENIUM; Lennon Stella; pilton";";";4xkm03zMAQXHc0QHl0V2Rm
Takeaway (feat. Lennon Stella) - Owen Norton Remix;";";"The Chainsmokers; ILLENIUM; Lennon Stella; Owen Norton";";";76EI5put5PkU2FD2rJKegT
Takeaway (feat. Lennon Stella) - DCB Remix;";";"The Chainsmokers; ILLENIUM; Lennon Stella; DCB";";";3bhuHxmAB7VWWlvbYFJd13
Call You Mine (feat. Bebe Rexha) - Lookas Remix;";";"The Chainsmokers; Bebe Rexha; Lookas";";";33ei0jpQYwV4doA4MQXcnB
Call You Mine (feat. Bebe Rexha) - Keanu Silva Remix;";";"The Chainsmokers; Bebe Rexha; Keanu Silva";";";75FpbthrwQmzHlBJLuGdC7
Call You Mine (feat. Bebe Rexha) - Asketa & Natan Chaim Remix;";";"The Chainsmokers; Bebe Rexha; Asketa & Natan Chaim";";";5EdYlCWou17k0N1PADLKfO
Call You Mine (feat. Bebe Rexha) - Parker Remix;";";"The Chainsmokers; Bebe Rexha; Parker";";";1IvDakWyjJk7qTQxSCVCtW
Call You Mine (feat. Bebe Rexha) - Lick Remix;";";"The Chainsmokers; Bebe Rexha; LICK";";";7bONfRheNAUCgcOPPVsMox
Call You Mine (feat. Bebe Rexha) - Sam Berson Remix;";";"The Chainsmokers; Bebe Rexha; Sam Berson";";";1i3MU0tvJvJG18guemO23N
Do You Mean (feat. Ty Dolla $ign & bülow) - Myon Remix;";";"The Chainsmokers; Ty Dolla $ign; bülow; Myon";";";4sqABRRGU7CzcHXCyxUzFw
Do You Mean (feat. Ty Dolla $ign & bülow) - Squalzz Remix;";";"The Chainsmokers; Ty Dolla $ign; bülow; Squalzz";";";78x0HSRvEkUq5nh4ErBByW
Do You Mean (feat. Ty Dolla $ign & bülow) - GRYNN Remix;";";"The Chainsmokers; Ty Dolla $ign; bülow; GRYNN";";";7tduKd9COe3aOtWgPYZ87s
Kills You Slowly - Sick Individuals Remix;";";"The Chainsmokers; Sick Individuals";";";2n57zaTroF1YHUtPAylcNi
Kills You Slowly - MOTi Remix;";";"The Chainsmokers; MOTi";";";64KOyvShvxxrsBQ0DlZvap
Kills You Slowly - Enschway Remix;";";"The Chainsmokers; Enschway";";";6PP4lOeigJ3BtcVZlFC2Me
Kills You Slowly - Pilton Remix;";";"The Chainsmokers; pilton";";";28fOqU1qMan1RVU2P1qeVc
Who Do You Love - R3HAB Remix;";";"The Chainsmokers; 5 Seconds of Summer; R3HAB";";";5QkVPG2Hf3MmAarireF6lh
Hope (feat. Winona Oak) - Nolan van Lith Remix;";";"The Chainsmokers; Winona Oak; Nolan van Lith";";";6Q4PHzZuSIKKcYL0eNdlE7
Hope (feat. Winona Oak) - Parker Remix;";";"The Chainsmokers; Winona Oak; Parker";";";5xZjHkJ5TuHNMJeraaOaJC
Beach House - Ashworth Remix;";";"The Chainsmokers; Ashworth";";";5tjpOTsbVVbqWRQuymGnuy
Save Yourself - NGHTMRE VIP REMIX;";";"The Chainsmokers; NGHTMRE";";";0xCdQ9jYFDENkE2ck73CAc
This Feeling (feat. Kelsea Ballerini) - Afrojack & Disto Remix;";";"The Chainsmokers; Kelsea Ballerini; AFROJACK; DISTO";";";1zZ8DfrLf4fQgARxIKOs20
This Feeling (feat. Kelsea Ballerini) - Tom Staar Remix;";";"The Chainsmokers; Kelsea Ballerini; Tom Staar";";";14NutpUNAYWbWFS7zUHCxk
This Feeling (feat. Kelsea Ballerini) - Young Bombs Remix;";";"The Chainsmokers; Kelsea Ballerini; Young Bombs";";";54eOmDg8gQNwl0rtr2l3Wo
This Feeling (feat. Kelsea Ballerini) - Tim Gunter Remix;";";"The Chainsmokers; Kelsea Ballerini; Tim Gunter";";";35zWpeXJ71mprm8V9GOHpV
Side Effects - Fedde Le Grand Remix;";";"The Chainsmokers; Emily Warren; Fedde Le Grand";";";7FDaS1k08rwMoAThmzUkOZ
Side Effects - The Magician Remix;";";"The Chainsmokers; Emily Warren; The Magician";";";43HIlAHRIQf8l1wl1kb538
Side Effects - Nolan van Lith Remix;";";"The Chainsmokers; Emily Warren; Nolan van Lith";";";185CVwvQgfW5QXXeuLv7Rl
Side Effects - Barkley Remix;";";"The Chainsmokers; Emily Warren; Barkley";";";2gnzQU9B3B2bhDZqIu6kqI
Side Effects - Sly Remix;";";"The Chainsmokers; Emily Warren; Sly";";";4PL3upmMwx5N3bdN62reVq
Somebody - Riggi & Piros Remix;";";"The Chainsmokers; Drew Love; Riggi & Piros";";";0zp6l1YYHDoGL8pci1CNfY
Somebody - T-Mass Remix;";";"The Chainsmokers; Drew Love; T-Mass";";";0Q7kvwpJk86EYT7zfWv5uf
Somebody - Naderi Remix;";";"The Chainsmokers; Drew Love; Naderi";";";2suJREXIjokgogs9eqSVUN
Somebody - Fluencee Remix;";";"The Chainsmokers; Drew Love; Fluencee";";";0LlleCJVkI3axaEZvksrXd
Somebody - Sippy Remix;";";"The Chainsmokers; Drew Love; SIPPY";";";5wsZ9fE3f06lrbYeS6A2Oq
Somebody - Ruhde Remix;";";"The Chainsmokers; Drew Love; Ruhde";";";42gkSeUtmr7gwxT62BJGiZ
Everybody Hates Me - Justin Caruso Remix;";";"The Chainsmokers; Justin Caruso";";";6dVCu2GnnseLcNyT9sPhZU
Everybody Hates Me - Steerner Remix;";";"The Chainsmokers; Steerner";";";3UEfOvhtrnpw57gDbSixri
Everybody Hates Me - Khrebto Remix;";";"The Chainsmokers; Khrebto";";";4hJolpt4ZqzoZuET5l3rzV
Everybody Hates Me - Michael Mar Remix;";";"The Chainsmokers; Michael Mar";";";538xJh841qQohKQJ8E5eiK
Everybody Hates Me - Linn Remix;";";"The Chainsmokers; Linn";";";1enQ4z8bxfoXqQ3jQQM8J5
You Owe Me - Whyel Remix;";";"The Chainsmokers; Whyel";";";1Er7sc4uGT6xNuRhNSYaBF
You Owe Me - Nonsens Remix;";";"The Chainsmokers; Nonsens";";";3owbWlM89q53TbnMPJTpnh
You Owe Me - Subfer Remix;";";"The Chainsmokers; Subfer";";";793L9VYMEBkbA6pzT53usi
You Owe Me - inverness Remix;";";"The Chainsmokers; inverness";";";7h7HhUwiROy72UfyT6O2d4
You Owe Me - Magnace Remix;";";"The Chainsmokers; Magnace";";";6EJMN1wW6ciSAB57yRLErU
Sick Boy - Zaxx Remix;";";"The Chainsmokers; Zaxx";";";7D3lo0ShsjY84Yh9m7hn0J
Sick Boy - Prismo Remix;";";"The Chainsmokers; Prismo";";";42ZPwraf4eA3q5Fqtdacjr
Sick Boy - Owen Norton Remix;";";"The Chainsmokers; Owen Norton";";";4B3NahKokb7lLkvaLFZFzn
Sick Boy - Kuur Remix;";";"The Chainsmokers; Kuur";";";7uGDVBUBtf1SblnoeSGCYQ
Sick Boy - Trobi Remix;";";"The Chainsmokers; Trobi";";";5wY5vXuojS9V4e9Nh9yrwS
Sick Boy - neutral. Remix;";";"The Chainsmokers; neutral.";";";3rESShKCG2y6GJyL28N0Z0
Young - K?D Remix;";";"The Chainsmokers; k?d";";";0ZEPdiFgQcWxmGU4uVMsHm
Young - KO:YU Remix;";";"The Chainsmokers; KO:YU";";";4GNBJYRTHfXqRCNa5mpTC2
Young - Midnight Kids Remix;";";"The Chainsmokers; Midnight Kids";";";6m2xm05irfWrrewq1Q3fyN
Young - Midnight Kids Remix;";";"The Chainsmokers; Midnight Kids";";";2g1dcVwh2fbCKzbxX2RgwZ
Honest - Tritonal Remix;";";"The Chainsmokers; Tritonal";";";0iWYUegJm3Ty16VEp69HLs
Honest - Lifelike Remix;";";"The Chainsmokers; Lifelike";";";4kityrbupfQVvc6p8LL68m
Honest - Rootkit Remix;";";"The Chainsmokers; Rootkit";";";2D7F8RfrbKNt348E5UIs7S
Honest - SAVI Remix;";";"The Chainsmokers; SAVI";";";5CYYljiI0WgstAMtsTALSw
Honest - Gil Glaze Remix;";";"The Chainsmokers; Gil Glaze";";";2Yp9RZD8reu2mQ2mgFGfOZ
Honest - Maliboux & UNKWN Remix;";";"The Chainsmokers; Maliboux; UNKWN";";";1e3eob0upYbHldLUMLBz8b
Something Just Like This - Tokyo Remix;";";"Coldplay; The Chainsmokers";";";5ffwnb6hqsKZp8cG6q90OW
Something Just Like This - Alesso Remix;";";"The Chainsmokers; Coldplay; Alesso";";";50RJdoxw8iajGNtHQe6QeS
Something Just Like This - R3hab Remix;";";"The Chainsmokers; Coldplay; R3HAB";";";0jTFKCb21Yd4UMV5Xk9EUz
Something Just Like This - Dimitri Vegas & Like Mike Remix;";";"The Chainsmokers; Coldplay; Dimitri Vegas & Like Mike";";";3LewMbGqmR4IYtifSNxbGz
Something Just Like This - Don Diablo Remix;";";"The Chainsmokers; Coldplay; Don Diablo";";";15MTd64KUMG7CF6mOyovsQ
Something Just Like This - Jai Wolf Remix;";";"The Chainsmokers; Coldplay; Jai Wolf";";";2oF42D2udxtL7Kr6WFFlGb
Something Just Like This - ARMNHMR Remix;";";"The Chainsmokers; Coldplay; ARMNHMR";";";2f3dQn9jfUwkgnPreXgByt
Something Just Like This;";";"The Chainsmokers; Coldplay";";";1dNIEtp7AY3oDAKCGg2XkH
Paris - VINAI Remix;";";"The Chainsmokers; VINAI";";";7ldlgbsVshuUnFWyimgBxn
Paris - LOUDPVCK Remix;";";"The Chainsmokers; LOUDPVCK";";";5ZQM4NzvXB4Hc0BG0ZHufF
Paris - Pegboard Nerds Remix;";";"The Chainsmokers; Pegboard Nerds";";";0zl9JGNm3Ob7XyMO0jqRwz
Paris - Jewelz & Sparks Remix;";";"The Chainsmokers; Jewelz & Sparks";";";5srtUQuIEmo9pqiIT8h2BG
Paris - Thieves Remix;";";"The Chainsmokers; THIEVES";";";1LrsP52ihuiVCpe3Lsxyze
Paris - FKYA Remix;";";"The Chainsmokers; FKYA";";";40120Gj8DGFiTb4h1ElwF9
Setting Fires - Blasterjaxx Remix;";";"The Chainsmokers; XYLØ; Blasterjaxx";";";3dqGLyXoP2Bo32eU6Rd8SQ
Setting Fires - Sigma Remix;";";"The Chainsmokers; XYLØ; Sigma";";";73iR1IX5l9vHZEWk1XSpry
Setting Fires - Vanic Remix;";";"The Chainsmokers; XYLØ; Vanic";";";4Cka9hWfkA8o0N8m0tPR0g
Setting Fires - Qulinez Remix;";";"The Chainsmokers; XYLØ; Qulinez";";";0QnVeGfbr0POpGZG0o0gA3
Setting Fires - BOXINBOX & Lionsize Remix;";";"The Chainsmokers; XYLØ; BOXINBOX; Lionsize";";";1Jfprqfanwu3w0uIddBuYs
All We Know (feat. Phoebe Ryan) - Oliver Heldens Remix;";";"The Chainsmokers; Phoebe Ryan; Oliver Heldens";";";5sWevAyvYSRzGpIsdsRvJi
Setting Fires;";";"The Chainsmokers; XYLØ";";";2PC9Tl8SWVO2yhDDtJcrAi
All We Know;";";"The Chainsmokers; Phoebe Ryan";";";65Qe0x9oCbs9pNJc6QBFx7
Closer;";";"The Chainsmokers; Halsey";";";7crMiinWx373rNBZBaVske
Inside Out;";";"The Chainsmokers; Charlee";";";4GdYM1hIvRfK8keBF2eQ1a
Don't Let Me Down;";";"The Chainsmokers; Daya";";";0w75KG0DuLDi6tdHmEMovD
All We Know;";";"The Chainsmokers; Phoebe Ryan";";";2rizacJSyD9S1IQUxUxnsK
Closer - R3hab Remix;";";"The Chainsmokers; Halsey; R3HAB";";";76pD98ghY1Hl05aDXzuFmq
Closer - Shaun Frank Remix;";";"The Chainsmokers; Halsey; Shaun Frank";";";7e8TWUFkE0wSF78cLJEgwe
Closer - T-Mass Remix;";";"The Chainsmokers; Halsey; T-Mass";";";33ecyF2OHCK4HFUSp1hItE
Closer - Wuki Remix;";";"The Chainsmokers; Halsey; Wuki";";";2PG9yLaY0zR2oWHPMl4tea
Closer - ARMNHMR Remix;";";"The Chainsmokers; Halsey; ARMNHMR";";";5MfstOgBJxNikoR2z8eyFX
Closer - Robotaki Remix;";";"The Chainsmokers; Halsey; Robotaki";";";14FxT9UrYFQup38Ub3CBDu
Closer;";";"The Chainsmokers; Halsey";";";7BKLCZ1jbUBVqRi2FVlTVw
New York City - Dash Berlin Remix;";";"The Chainsmokers; Dash Berlin";";";2dE5PeX0GBLTRyrDVnFnS3
Roses (feat. ROZES) - The Him Remix;";";"The Chainsmokers; ROZES; The Him";";";4ZsjbipIP09tLf6gdURakt
Roses (feat. ROZES) - Zaxx Remix;";";"The Chainsmokers; ROZES; Zaxx";";";5MgBUUjbkQ27Kd9CbeZFLo
Roses (feat. ROZES) - King Arthur Remix;";";"The Chainsmokers; ROZES; King Topher";";";0847zzvgxj84ExNmjO3MuA
Roses (feat. ROZES) - Loosid Remix;";";"The Chainsmokers; ROZES; Loosid";";";2vy3FUf4Fai7UzqCI9b4IL
Roses (feat. ROZES) - Lookas Remix;";";"The Chainsmokers; ROZES; Lookas";";";6Yk4bl2ZRvbf8igj4oQvmV
Until You Were Gone (feat. Emily Warren) - Boehm Remix;";";"The Chainsmokers; Tritonal; Emily Warren; Boehm";";";0rWV9qjGDfeDmECGyeAXPV
Until You Were Gone (feat. Emily Warren) - Skrux & Saturn Remix;";";"The Chainsmokers; Tritonal; Emily Warren; Skrux & Saturn";";";1pgyHZNpzYB4aRUdD0dQgI
Until You Were Gone (feat. Emily Warren) - Reez Remix;";";"The Chainsmokers; Tritonal; Emily Warren; Reez";";";0Ew1kz7hJjOTpH5IAwLcSU
Roses (feat. ROZES);";";"The Chainsmokers; ROZES";";";3FWPoYBDserKdzcattMFGa
Until You Were Gone (feat. Emily Warren);";";"The Chainsmokers; Tritonal; Emily Warren";";";2ndF5ctDJrYK3eJhRbp1jO
Waterbed (feat. Waterbed);";";"The Chainsmokers; Waterbed";";";5glABIjb1lnJ2zLl3RxQEI
Good Intentions (feat. BullySongs);";";"The Chainsmokers; BullySongs";";";0UJ6g9ok6yDphPqJvY1YRo
Until You Were Gone;";";"The Chainsmokers; Tritonal; Emily Warren";";";12MqM3S0fTvR6X4Jt1Xvn6
Split (Only U);";";"Tiësto; The Chainsmokers";";";1Q4jb2UjtWUDUojHsB8mLY
Waterbed;";";"The Chainsmokers; Waterbed";";";1x5M7e748IC3LOejjvdOia
Good Intentions (Unlike Pluto Remix) (feat. BullySongs);";";"The Chainsmokers; BullySongs";";";68mjb0JiA9HSJpaHcgiPdK
Good Intentions (DallasK Remix) (feat. BullySongs);";";"The Chainsmokers; BullySongs";";";7cTqWOMmVlaknLoASZoLjH
Good Intentions (Speaker of the House Remix) (feat. BullySongs);";";"The Chainsmokers; BullySongs";";";0Mu7reuGXEvMiJPNrPRc09
Roses;";";"The Chainsmokers; ROZES";";";3vv9phIu6Y1vX3jcqaGz5Z
Let You Go - A-Trak Remix;";";"The Chainsmokers; Great Good Fine Ok";";";3YmiIqDgrq1zPVF2uPMKpo
Good Intentions;";";"The Chainsmokers; BullySongs";";";2LZiSLXPReoKHccIPuRPOV
Let You Go - Radio Edit;";";"The Chainsmokers; Great Good Fine Ok";";";2Mh0jU5IyRTQfpyMnvki5Z
Let You Go - Mix Show Edit;";";"The Chainsmokers; Great Good Fine Ok";";";1RwEbVYiD3FpQobml168Kl
Kanye - Steve Aoki & twoloud Remix;";";"The Chainsmokers; sirenXX; Steve Aoki; twoloud";";";07wExbSybe0F6BtQjkjGSw
Kanye - Riggi & Piros Remix;";";"The Chainsmokers; sirenXX; Riggi; Piros";";";0J5uTirxss3D3SjX7hQat9
Kanye - Reece Low Remix;";";"The Chainsmokers; sirenXX; Reece Low";";";3MNp2utvqYvgDa0DCvuqZz
Kanye - Don Diablo Remix;";";"The Chainsmokers; sirenXX; Don Diablo";";";3MNGCgYMF8IAQNGLjauG5M
Kanye - Ookay Remix;";";"The Chainsmokers; sirenXX; Ookay";";";13hVbpGg9bJPDafFXvwDla
Kanye - Chardy Remix;";";"The Chainsmokers; sirenXX; Chardy";";";0jcok2Ib2uNhzrXRewCgJV
Kanye - Louis The Child Remix;";";"The Chainsmokers; sirenXX; Louis The Child";";";6JMtsVjR75qRma36b8nStS
Kanye;";";"The Chainsmokers; sirenXX";";";5brMyscUnQg14hMriS91ks
#SELFIE - Will Sparks Remix;";";"The Chainsmokers; Will Sparks";";";74KKgFD4VKyS8X2yyfjYh8
#SELFIE - Botnek Remix;";";"The Chainsmokers; Botnek";";";0Xo4GBfnoUrBozjpOF2l3D
#SELFIE - Caked Up Remix;";";"The Chainsmokers; Caked Up";";";2p177tRRa3AaTXumcnLBXr
