Nome da Música;Artistas;ID da Música
Whenever, Wherever - Sahara Mix;";";"Shakira; Tamer Zeitoun; Hani Kamal";";";4IXwdtnrNq5fPQRqAuJwam
Whenever, Wherever - Pepsi Super Bowl LIV Halftime Show Remix;";";"Shakira; Alexander Castillo";";";59QI3gSnv576kHyV4Jqt36
Perro Fiel/El Perdón Medley (feat. Nicky Jam) - El Dorado World Tour Live;";";"Shakira; Nicky Jam";";";6w007TZFxbvuuJKHvsnEOq
Chantaje (feat. Maluma) - El Dorado World Tour Live;";";"Shakira; Maluma";";";00WhZxJjmFz42OqzGnkoBD
La Tortura (feat. Alejandro Sanz) - El Dorado World Tour Live;";";"Shakira; Alejandro Sanz";";";2yezLHbV731G2XD0T5SdH4
La Bicicleta - El Dorado World Tour Live;";";"Shakira; Carlos Vives";";";1V9sgqbGBjcgi9gzQBR2b9
Chantaje (feat. Maluma);";";"Shakira; Maluma";";";6mICuAdrwEjh6Y6lroV2Kg
Perro Fiel (feat. Nicky Jam);";";"Shakira; Nicky Jam";";";70lnL3QaSOIIyMa2X9aVRL
Trap (feat. Maluma);";";"Shakira; Maluma";";";7GncL3nyKUjsEm8Z5gvTpW
Comme moi (feat. Shakira);";";"Black M; Shakira";";";2RHpEALdmp9dnPuEm7SLKB
La Bicicleta;";";"Carlos Vives; Shakira";";";0sXvAOmXgjR2QUqLK1MltU
Deja vu;";";"Prince Royce; Shakira";";";5clmffOxeckeJ2e3GMy6UZ
What We Said (feat. MAGIC!) - Comme moi English Version;";";"Shakira; MAGIC!";";";0kM7Geaz7x7r17CPONjpOU
Cut Me Deep (feat. MAGIC!);";";"Shakira; MAGIC!";";";3az4yF4Rq9uYXYH3FPDV08
Medicine (feat. Blake Shelton);";";"Shakira; Blake Shelton";";";7vvqns9A9v9CuC8MlUDPnC
La La La (Brasil 2014) (feat. Carlinhos Brown);";";"Shakira; Carlinhos Brown";";";6i2kn3iS5WKzsaYBdeHLIQ
Can't Remember to Forget You (feat. Rihanna);";";"Shakira; Rihanna";";";7o1Pm9jpH0wFpN5g793Lnq
Loca (feat. El Cata);";";"Shakira; El Cata";";";42k1KeBehAd83lrGt1okiC
Gordita (feat. Residente Calle 13);";";"Shakira; Calle 13";";";6fufW0yhOYcNHvAaUwgpS1
Rabiosa (feat. El Cata);";";"Shakira; El Cata";";";19t0Z7qsoV6A1CGJVYRnjm
Loca (feat. Dizzee Rascal);";";"Shakira; Dizzee Rascal";";";6YMPu36VGIknb8Ey1ohW3j
Rabiosa (feat. Pitbull);";";"Shakira; Pitbull";";";2Xh7dyCHCErCv3PmdVEGw4
Loca (feat. Dizzee Rascal) - Freemasons Radio Edit;";";"Shakira; Dizzee Rascal; Freemasons";";";2Sk7RnSVAQGcTovlJQ5FD1
Spy (feat. Wyclef Jean);";";"Shakira; Wyclef Jean";";";5c8vdQdRggwDspd3MNgjZX
Give It Up To Me (feat. Lil Wayne);";";"Shakira; Lil Wayne";";";5lR4YDKdhJUkGUYMrMRx43
Did It Again (feat. Kid Cudi);";";"Shakira; Kid Cudi";";";6AoGe1Zp6WNpPTvNC6Ehca
Illegal (feat. Carlos Santana);";";"Shakira; Carlos Santana";";";4O1xKPHOH7iXlzMNUDuxHS
Hips Don't Lie (feat. Wyclef Jean);";";"Shakira; Wyclef Jean";";";3ZFTkvIE7kyPt6Nu3PEa7V
The Day and the Time (feat. Gustavo Cerati);";";"Shakira; Gustavo Cerati";";";080gSRai7pWpGO8WsWk1Ww
La Tortura (feat. Alejandro Sanz) - Alternate Version;";";"Shakira; Alejandro Sanz";";";6UwBdW2wlO9ikUD3LU8GF3
La Tortura (feat. Alejandro Sanz);";";"Shakira; Alejandro Sanz";";";5BSclXJTa9B0iURhUjZo50
Dia Especial (feat. Gustavo Cerati);";";"Shakira; Gustavo Cerati";";";1XyRT1VeLaJs5rEJA3rMO9
No (feat. Gustavo Cerati);";";"Shakira; Gustavo Cerati";";";0J6dOwflFSy3h1AoKmkqKc
La Tortura (feat. Alejandro Sanz) - Shaketon Remix;";";"Shakira; Alejandro Sanz";";";3FsGjnnVi70WRUHOmopafn
Shakira DJ Memegamix;";";"Shakira; Marcelo ""Meme"" Manzur";";";5q8W8snuCXzh5HuTAX3nvI
El Jefe;";";"Shakira; Fuerza Regida";";";5wjsJIUf6pdrwauPDae43o
Copa Vacía;";";"Shakira; Manuel Turizo";";";2iVgM5C7m1G4CJGbms301G
TQG;";";"KAROL G; Shakira";";";2oMjKuKUEJFuLiVmTq7Vjx
Shakira: Bzrp Music Sessions, Vol. 53;";";"Bizarrap; Shakira";";";4nrPB8O7Y7wsOCJdgXkthe
Monotonía;";";"Shakira; Ozuna";";";6G12ZafqofSq7YtrMqUm76
DON'T YOU WORRY (Farruko Remix) (with Farruko, David Guetta & Shakira);";";"Black Eyed Peas; Farruko; Shakira; David Guetta";";";6Qk9crrlslodQnHqhCmjtC
DON'T YOU WORRY;";";"Black Eyed Peas; Shakira; David Guetta";";";0gYXw7aPoybWFfB7btQ0eM
Te Felicito;";";"Shakira; Rauw Alejandro";";";2rurDawMfoKP4uHyb2kJBt
GIRL LIKE ME;";";"Black Eyed Peas; Shakira";";";0LUdGEOj20wBg5M9BHrFTl
GIRL LIKE ME - twocolors remix;";";"Black Eyed Peas; Shakira; twocolors";";";19tO5sNxHHJcX7CUPMVykl
GIRL LIKE ME - twocolors extended;";";"Black Eyed Peas; Shakira; twocolors";";";4B46HvJMaZj3UfogZo6ZyX
Me Gusta;";";"Shakira; Anuel AA";";";5Xhqh4lwJPtMUTsdBztN1a
Tutu - Remix;";";"Camilo; Shakira; Pedro Capó";";";302I7g0l3jmAbzFu9WBCmu
Clandestino;";";"Shakira; Maluma";";";7DrluKkTviBwCc8AV3VGmf
Chantaje (feat. Maluma) - Versión Salsa;";";"Shakira; Maluma";";";7FbaWIOO2WojXWw2DUyEVv
Chantaje (feat. Maluma) - John-Blake Remix;";";"Shakira; Maluma";";";23bdFaePepmoGrsFY4h3S0
La Bicicleta (feat. Maluma) - Remix;";";"Carlos Vives; Shakira; Maluma";";";7IRuf7FrdQvOGs0g9mSNGr
La Bicicleta - Versión Vallenato;";";"Carlos Vives; Shakira";";";7zcDKECc3YKma2fKErzwey
La Bicicleta - Versión Pop;";";"Carlos Vives; Shakira";";";0vLpsYMkgq8Dysx8pIdVkK
Dare (La La La) - Dirtyloud Remix;";";"Shakira; Marcus Vinicius Campos; Eduardo Nascimento";";";6FtnnIxBSt7hu0XiNFJ8Uv
Dare (La La La) - Chuckie Remix;";";"Shakira; Chuckie";";";60UKV4dNRqbHvAhhtkna78
Dare (La La La) - Chus & Ceballos Brazil Fiesta Remix;";";"Shakira; Chus L. Esteban; Jose Ceballos";";";02JvW8kKq1raXL6bZZTbaE
Can't Remember to Forget You (feat. Rihanna) - Fedde Le Grand Remix;";";"Shakira; Rihanna; Fedde Le Grand; Robin M. Christopher";";";3yNVRe7CmqPYE0RkWWqry6
Can't Remember to Forget You - Wideboys Remix;";";"Shakira; Wideboys";";";5NTWI8LFGCjXcvZsmtG6VQ
Waka Waka (Esto es Africa) (feat. Freshlyground);";";"Shakira; Freshlyground";";";0W8nDs4H2cqxxAgszNMYO3
She Wolf - sped-up;";";"Shakira; sped up + slowed";";";1pY1a9Fo733TW46r027Khx
Loba - sped-up;";";"Shakira; sped up + slowed";";";0kjpYG3EB4I1t9IVkolWJY
Hips Don't Lie (feat. Wyclef Jean) - Live - December 2006;";";"Shakira; Wyclef Jean";";";52XoFtAGfg9AFuCB4YCcVQ
Beautiful Liar;";";"Beyoncé; Shakira";";";1NUbusXzDLdrLNvSd9aizW
Beautiful Liar - Freemasons Remix Edit;";";"Beyoncé; Shakira";";";75Sup6tL1PrAVO9AoGzaJB
Beautiful Liar;";";"Beyoncé; Shakira";";";2P5cIXejqLpHDQeCHAbbBG
Illegal (feat. Carlos Santana);";";"Shakira; Carlos Santana";";";0uijaZnutuzkR5DExomRma
Hips Don't Lie - Bamboo (feat. Wyclef Jean);";";"Shakira; Wyclef Jean";";";4u1JdEq8JcBZipQUs6tih7
