Nome da Música;Artistas;ID da Música
I’m Not Real (feat. Earl Sweatshirt);";";"Mac Miller; Earl Sweatshirt";";";1kpZPLcrLULlN05Ps7q8gM
Matches (feat. Ab-Soul);";";"Mac Miller; Ab-Soul";";";55Mz1mxpT7eDM8oqwujhjT
I Am Who Am (Killin' Time) [feat. Niki Randa];";";"Mac Miller; Niki Randa";";";2eIDSNXVUariZsHfY1eOtK
Red Dot Music (feat. Action Bronson);";";"Mac Miller; Action Bronson";";";0uN5rMZdcCQuZgxcOxLKzs
Gees (feat. ScHoolboy Q);";";"Mac Miller; ScHoolboy Q";";";6BrcJDtjKBqxyfXPUy0R0W
O.K. (feat. Tyler, The Creator) - Bonus Track;";";"Mac Miller; Tyler, The Creator";";";3fc6y2t7MsdRXTiyWSjI4s
Claymation (feat. Vinny Radio) - Bonus Track;";";"Mac Miller; Vinny Radio";";";6OyBuptN7bmKQy14x8o9Fy
The Star Room (OG Version) - Bonus Track;";";"Mac Miller; Earl Sweatshirt";";";3A1TIw1yMxj5OckDuqRtiT
Love Lost;";";"Mac Miller; The Temper Trap";";";2z9iuAxKv4TTeCrPAxxKg9
Pranks 4 Players (feat. Sir Michael Rocks);";";"Mac Miller; Sir Michael Rocks";";";6qTUyVWe0o7oOBjKrt2kNH
Family First (feat. Talib Kweli);";";"Mac Miller; Talib Kweli";";";0S3aJEDYwgwe8XKtOWtI5R
Boom Bap Rap (feat. The Come Up);";";"Mac Miller; The Come Up";";";7heqvN003PlMiy7IlnVn9y
All That (feat. Bun B);";";"Mac Miller; Bun B";";";5w8PL2MankfhH1Q7krIOSw
Friends (feat. ScHoolboy Q);";";"Mac Miller; ScHoolboy Q";";";4CLf6A64qIzDHoP5lOonsP
What Do You Do (feat. Sir Michael Rocks);";";"Mac Miller; Sir Michael Rocks";";";6HQC66NOPyXDy4TEoO6WDE
Polo Jeans (feat. Earl Sweatshirt);";";"Mac Miller; Earl Sweatshirt";";";367HmvU5MpsWZdAJ3QbGlZ
Insomniak (feat. Rick Ross);";";"Mac Miller; Rick Ross";";";0qdSK9Nr5OAvWzPA5OHxw7
Uber (feat. Mike Jones);";";"Mac Miller; Mike Jones";";";0BJU3HPSwhJEg6xvXOgCBr
Rain (feat. Vince Staples);";";"Mac Miller; Vince Staples";";";5P4Dow1Jc2NhkknIuPi5Nd
New Faces v2 (feat. Earl Sweatshirt and Da$h);";";"Mac Miller; Earl Sweatshirt; Da$H";";";2vl4TbiGkdTqD4UXnqTDhp
Congratulations (feat. Bilal);";";"Mac Miller; Bilal";";";1OubIZ0ARYCUq5kceYUQiO
Dang! (feat. Anderson .Paak);";";"Mac Miller; Anderson .Paak";";";5iUQMwxUPdJBFeGkePtM66
Cinderella (feat. Ty Dolla $ign);";";"Mac Miller; Ty Dolla $ign";";";2lpygKqzPFtItQ4ss3cgfb
Planet God Damn (feat. Njomza);";";"Mac Miller; NJOMZA";";";7bd0BC9RNR6GxJsM3pRwBw
We (feat. CeeLo Green);";";"Mac Miller; CeeLo Green";";";4k5UZm89ZX0YAHUp55zpt9
My Favorite Part;";";"Mac Miller; Ariana Grande";";";66wkCYWlXzSTQAfnsPBptt
God Is Fair, Sexy Nasty (feat. Kendrick Lamar);";";"Mac Miller; Kendrick Lamar";";";6hzbRKhJHo6cfCHSnNaDS8
I'll Be There (feat. Phonte);";";"Mac Miller; Phonte";";";3P46ih3fvfw4HFT3JNwsbW
Keep Floatin' (feat. Wiz Khalifa);";";"Mac Miller; Wiz Khalifa";";";14qCM2eXa3DEqTxsC2uylp
Two Matches (feat. Ab-Soul);";";"Mac Miller; Ab-Soul";";";5dhYmSVGhAVVSf5uTwj7hv
Time Flies (feat. Lil B);";";"Mac Miller; Lil B";";";613sTvP8USXm8SEKWsqCuv
Weekend (feat. Miguel);";";"Mac Miller; Miguel";";";6GnhWMhgJb7uyiiPEiEkDA
Cut the Check (feat. Chief Keef);";";"Mac Miller; Chief Keef";";";6U1ueRYXTjFHuJ9Ld2LBIW
The Festival (feat. Little Dragon);";";"Mac Miller; Little Dragon";";";1cMIaPv3DTyOGeNe2h6igm
Earth (feat. Future);";";"Mac Miller; Future";";";4of212tKuGPXX0TckB3FYx
In The Morning (feat. Thundercat & Syd);";";"Mac Miller; Thundercat; Syd";";";7LgS0qb2LD0uqhNvVApDWd
I’m Not Real (feat. Earl Sweatshirt);";";"Mac Miller; Earl Sweatshirt";";";1ntksaOoxI4D6hAVjESIuJ
Matches (feat. Ab-Soul);";";"Mac Miller; Ab-Soul";";";51I63p6gnbQhty1mlhvnME
I Am Who Am (Killin' Time) [feat. Niki Randa];";";"Mac Miller; Niki Randa";";";0VY16z1dVA9wUTeEtB0MQo
Red Dot Music (feat. Action Bronson);";";"Mac Miller; Action Bronson";";";3G8xKBPsOgViF0V9ffwozx
Gees (feat. ScHoolboy Q);";";"Mac Miller; ScHoolboy Q";";";3QtvqDE3siGOPPZns8aLz8
Aliens Fighting Robots (feat. Sir Michael Rocks);";";"Mac Miller; Sir Michael Rocks";";";22V5hJrB2N3tHYPbWmklBu
Fight the Feeling (feat. Kendrick Lamar & Iman Omari);";";"Mac Miller; Kendrick Lamar; Iman Omari";";";0jFxJ1US3dmwQn7DJi269h
Lucky Ass Bitch (with Juicy J);";";"Mac Miller; Juicy J";";";5Ec3FoZR4X6SRHyCle3qHS
Ignorant (feat. Cam'ron);";";"Mac Miller; Cam'ron";";";529RPWaWNlqffX6XcCm931
The Question (feat. Lil Wayne);";";"Mac Miller; Lil Wayne";";";29tKprMGnf4yxIhWmN0NHq
Sunlight (feat. Iman Omari);";";"Mac Miller; Iman Omari";";";7g9GUBX7TiAF2Zj3lxTde0
America (feat. Casey Veggies & Joey Bada$$);";";"Mac Miller; Casey Veggies; Joey Bada$$";";";4nqKmqW4O2XG9kyeVIrKLg
The Spins;";";"Mac Miller; Empire of the Sun";";";7FAFkQQZFeNwOFzTrSDFIh
Paper Route (feat. Chevy Woods);";";"Mac Miller; Chevy Woods";";";4CV58jALE66Q1c2Kawmzgf
Mad Flava, Heavy Flow (Interlude) [feat. DJ Bonics];";";"Mac Miller; DJ Bonics";";";3EWurUu16gua9aYNy6uYUq
The Spins;";";"Mac Miller; Empire of the Sun";";";7BcOUi4FQ3wBLmNTW0yfCR
Paper Route (feat. Chevy Woods);";";"Mac Miller; Chevy Woods";";";1DcYoPIPUo2mu8302RwRMr
Mad Flava, Heavy Flow (Interlude) [feat. DJ Bonics];";";"Mac Miller; DJ Bonics";";";63DnATe4dssJYCSeX0D9rg
Therapy pt. 2 [Feat. Mac Miller];";";"Robert Glasper; Mac Miller";";";5dNQ0AsPitoIQSRbsXKKwE
I Believed It (feat. Mac Miller);";";"dvsn; Ty Dolla $ign; Mac Miller";";";47dc7fsSfI70ML6wRedq6W
That's Life (feat. Mac Miller & Sia);";";"88-Keys; Mac Miller; Sia";";";5h0Jgt873QtgL6nJRBGfT6
Time;";";"Free Nationals; Mac Miller; Kali Uchis";";";05v5mPkLAOoa7M5tnXXOwq
Dang! (feat. Anderson .Paak) - Radio Edit;";";"Mac Miller; Anderson .Paak";";";0KWR1t2LdkmEVwEIh2v035
Lucky Ass Bitch (feat. Juicy J);";";"Mac Miller; Juicy J";";";6oQSSxiDqsytlwEHQS1JEv
