Nome da Música;Artistas;ID da Música
California;";";"MOUNT WESTMORE; Snoop Dogg; Ice Cube; E-40; Too $hort";";";6pX5OCtFjlryOeTpLWht9L
Motto;";";"MOUNT WESTMORE; Snoop Dogg; Ice Cube; E-40; Too $hort";";";5pl5zY6EgRp2dbsYFxzWbM
Big Subwoofer;";";"MOUNT WESTMORE; Snoop Dogg; Ice Cube; E-40; Too $hort";";";1Z6icGTEF6VPG1FVkLQyIS
Too Big;";";"MOUNT WESTMORE; Snoop Dogg; Ice Cube; E-40; Too $hort; P-Lo";";";0cLZTPuy1q3rJzA9IhHXaA
Activated;";";"MOUNT WESTMORE; Snoop Dogg; Ice Cube; E-40; Too $hort";";";4Gym9aGuwGulwgZqPJfqCi
Have A Nice Day;";";"MOUNT WESTMORE; Snoop Dogg; Ice Cube; E-40; Too $hort";";";1H3iFlT3jKjcD92ut8LnHT
Ghetto Gutter;";";"MOUNT WESTMORE; Snoop Dogg; Ice Cube; E-40; Too $hort";";";49hhPeqzFc7grL2KHtruxl
Free Game;";";"MOUNT WESTMORE; Snoop Dogg; Ice Cube; E-40; Too $hort";";";2AhqNnmHOm3kwRXbmG4Buj
I Got Pull;";";"MOUNT WESTMORE; Snoop Dogg; Ice Cube; E-40; Too $hort";";";5UlSiBRXugG8C8w96nndsr
Up & Down;";";"MOUNT WESTMORE; Snoop Dogg; Ice Cube; E-40; Too $hort";";";2c1m8rgZa9pAkqAWuO73NC
Do My Best;";";"MOUNT WESTMORE; Snoop Dogg; Ice Cube; E-40; Too $hort";";";2SkgBqfvldIf0y9LwPDFSv
Lace You Up;";";"MOUNT WESTMORE; Snoop Dogg; Ice Cube; E-40; Too $hort";";";74j9Abd7T10mnbQq3uvgHa
Tribal;";";"MOUNT WESTMORE; Snoop Dogg; Ice Cube; E-40; Too $hort";";";2nBCZ3WMQdhku15BATi0Hj
How Many;";";"MOUNT WESTMORE; Snoop Dogg; Ice Cube; E-40; Too $hort";";";7LHX7KARroiWVi4MAThhh6
On Camera;";";"MOUNT WESTMORE; Snoop Dogg; Ice Cube; E-40; Too $hort";";";3tAPTN9SG6FCuVHTMwwyDG
Mash;";";"MOUNT WESTMORE; Snoop Dogg; Ice Cube; E-40; Too $hort";";";6E2oey11qMSF3WOPMUHPxl
Intro;";";"Snoop Dogg; DJ Drama";";";7uhuCyUgZzq2teMExWBIZk
I'm From 21st Street;";";"Snoop Dogg; DJ Drama; Stressmatic";";";34LfKSiRgJbMDVT99DQwfI
I'll Holla Back;";";"Snoop Dogg; DJ Drama; Kurupt; Dave East";";";73L9J10go7Kf5yKOhCN8YU
I Still Got It;";";"Snoop Dogg; DJ Drama";";";6UpO3bAhGxrsHzk41HyOJK
Lit;";";"Snoop Dogg; DJ Drama; Daz Dillinger";";";3irlnwNOnseNEfnIlBjxTY
The Price Went Up;";";"JANE HANDCOCK; Snoop Dogg";";";7FbX29mSkRsAFdqKOtwshW
My City;";";"Snoop Dogg; DJ Drama; Dave East";";";6P5rwHPAfRrtLYAR2R0dg1
No Half Steppin;";";"Snoop Dogg; DJ Drama";";";3IEYo3YVx9m17Jr8ZM4qSp
Been Smokin;";";"Snoop Dogg; DJ Drama; Juicy J";";";7HU0AQ32McpPcpRfRClJU2
Lime and Squeeze;";";"October London; Snoop Dogg";";";3x00D6vrZVpGIVZDZ4AuCH
Girls Love Snoop;";";"JANE HANDCOCK; Snoop Dogg";";";2po4ihyng69XdgRgmwGIcT
Around Here;";";"Snoop Dogg; DJ Drama; Seddy Hendrinx";";";5II8S137GH5dYxLpGJ9KNz
Dolla Signs;";";"Snoop Dogg; DJ Drama; Trinidad James";";";5RG43IZ0rFEjPMGsw2ODD7
Hotline;";";"Snoop Dogg; October London";";";4D1bpfLstALUXEVYccjL3E
It really Turns Me On;";";"Snoop Dogg; Chris Brown";";";0rck5bL7GgwUTxsAT0URDO
Rollin down the Highway;";";"Snoop Dogg; Warren G; Nate Dogg";";";5rzk26aHkfJRoBqjC5MfGw
U Neva Had it Like This;";";"Snoop Dogg; Warren G";";";3bWbBfa5yAKpall5iKaYgS
Big Snoop Has That Fire;";";"Snoop Dogg; Wiz Khalifa";";";7o6DlaWo2ksEWlyAKg1EZW
Keep On Ridin;";";"Snoop Dogg; Tha Dogg Pound; Butch Cassidy";";";2Te9iXWPaJhU67V6Og2X7V
Bad;";";"Snoop Dogg; Tha Eastsidaz";";";4a1IPD9ANhNhnw0SVHJVnx
Touch Away;";";"Snoop Dogg; October London";";";073oXlVIh4rKYdgOBNr9j5
Bron & Bronny;";";"Snoop Dogg; Champ Medici";";";2w5Km6uPUThxL6UfKWhz0d
Everybody Watching;";";"Snoop Dogg; Raphael Saadiq; Miguel";";";1nHMytYSkk9bmMEVa7j5bY
Mulholland Drive;";";"Snoop Dogg; October London; LaToiya Williams";";";70RUzztH81zpAMm9jbMLDi
Mad Mans World;";";"Snoop Dogg; JANE HANDCOCK";";";2z46qBfq56POEyndWpFAmc
World Go Round;";";"Snoop Dogg; Uncle Chucc";";";249g0xiWIoBaD9hWfEXF1X
Whoopty Whoop;";";"Snoop Dogg; Tha Dogg Pound";";";4dWengusJN6idp9dRYKJhu
Higher Power;";";"Snoop Dogg; 84faces";";";1cjmK4LqVvMRxcu5iBnncB
Put You Thru Hell;";";"Snoop Dogg; Minnie Merda";";";6SVuLZuwSTf9TWeULaZHLi
Baila Conmigo;";";"Snoop Dogg; October London";";";1RaU1RHF7WKmK70vWiWarb
Verbalize;";";"Snoop Dogg; Stokely";";";3qLGnjsA1Vqy8gOyxJKlbS
Wait a Minute Baby;";";"Snoop Dogg; Raphael Saadiq; October London; J-Black";";";7aGmouRIlGa893lcdx5ZQX
Runnin;";";"Snoop Dogg; HeyDeon";";";6QD3ucuy0OPYUCTpjlXB0r
Coming Back;";";"Snoop Dogg; October London; Nefertitti Avani";";";34OfVb8885GyOLPN1wHQ9U
Conflicted;";";"Snoop Dogg; Nas";";";5T4zLnPeoi7bES97eG0Z7h
Daddy;";";"Snoop Dogg; Emo Trap";";";7GAjti228PU4Lwv15okghJ
Gotta Keep Pushing;";";"Snoop Dogg; T.I.; Sleepy Brown";";";5lCKA1p26RpKQc3EbDQ0MT
Outside The Box;";";"Snoop Dogg; Nate Dogg";";";0hbPdHxWGRQFryHB3YKajd
Jerseys In The Rafters;";";"Snoop Dogg; The Game";";";53ADNaf76asls2UvNUHSo5
Pop Pop;";";"Snoop Dogg; DaBaby";";";48reuH21JEQ21sTqcswqwi
Catch a Vibe;";";"Snoop Dogg; HeyDeon";";";6u2ab08VBKxCb8sXtHNm51
It’s In The Air;";";"Snoop Dogg; Uncle Murda; JANE HANDCOCK";";";1BNp5ifOfQSAv2pQUuq6Hs
We Don’t Gotta Worry No More;";";"Snoop Dogg; Wiz Khalifa";";";3I6g9ZP5eVGbFaihTpDyFt
Get This Dick;";";"Snoop Dogg; Lil Duval; October London";";";46JleJdEFWSldFDORWV3rP
Snoopy Don’t Go;";";"Snoop Dogg; October London";";";2EefPdGSkB4JskQhNdmzeV
Roaches In My Ashtray;";";"Snoop Dogg; Prohoezak";";";6vvJf0KEqJUvKfNPUaLdXz
Gang Signs;";";"Snoop Dogg; Mozzy";";";4laGLspUjGjh1O0AZ2tEQk
Talk Dat Shit To Me;";";"Snoop Dogg; Kokane";";";2RVRSRGTWo3GdVL3gF6hF3
Say It Witcha Booty;";";"Snoop Dogg; Prohoezak";";";6tHTBacyjFBbp3clUbySxv
Get Yo Bread Up;";";"Snoop Dogg; Larry June";";";3Qkf2uPVdUGbKSGwhNvXMN
Fetty In The Bag;";";"Snoop Dogg; Goldie Loc; Big Tray Deee";";";2IssU3kSSoDWkmQeOyegpr
Look Around;";";"Snoop Dogg; J Black";";";0iMhMxDGK3C6xOYMC7VECp
Left My Weed;";";"Snoop Dogg; Devin The Dude; J Black";";";3w2xWMjAYjJhwLM4VbqDLq
So Misinformed (feat. Slick Rick);";";"Snoop Dogg; Slick Rick";";";63xavd8KQ7jB1ievKEhMgP
One Blood, One Cuzz (feat. DJ Battlecat);";";"Snoop Dogg; DJ Battlecat";";";02JgSD5rGufRrYHVkGELBB
Countdown (feat. Swizz Beatz);";";"Snoop Dogg; Swizz Beatz";";";2N1SyTYsvm0uLkJN9zqfzd
Turn Me On (feat. Chris Brown);";";"Snoop Dogg; Chris Brown";";";6WYuOvgMhrNM4L6igAkUsg
Blue Face Hunnids (feat. YG & Mustard);";";"Snoop Dogg; YG; Mustard";";";6XIsJIQ5OQe1ojOQJefW6F
Take Me Away (feat. Russ & Wiz Khalifa);";";"Snoop Dogg; Russ; Wiz Khalifa";";";08YwOYGFPB7ltBok0WQAFF
Do It When I'm In It (feat. Jermaine Dupri, Ozuna & Slim Jxmmi);";";"Snoop Dogg; Jermaine Dupri; Ozuna; Slim Jxmmi";";";7KnZjHM4BJDfZPFadIP6W0
First Place (feat. Tdot Illdude);";";"Snoop Dogg; Tdot illdude";";";2bkhz8WnhCECTdpBaMvBao
Rise To The Top (feat. Trey Songz & Swizz Beatz);";";"Snoop Dogg; Trey Songz; Swizz Beatz";";";1SFwhGdsFAj4jo2pKCf8W2
Wintertime in June (feat. Nate Dogg);";";"Snoop Dogg; Nate Dogg";";";328koIBcZe6tQfPMph2f4c
Doo Wop Thank Me (feat. The HamilTones);";";"Snoop Dogg; The HamilTones";";";569QUTfnUG3WqTnyEZQewA
Main Phone (feat. Rick Rock & Stressmatic);";";"Snoop Dogg; Rick Rock; Stressmatic";";";4hPuEKXZi4wUhRyDF0Cw0t
Do You Like I Do (feat. Lil Duval);";";"Snoop Dogg; Lil Duval";";";5UBvmiSmxXM5TQiqDNK40j
I've Been Looking For You (feat. Eric Jaye);";";"Snoop Dogg; Eric Jaye";";";1KYrTCOdDwi7ByYnmAOeRM
Little Square UBitchU (feat. Anitta);";";"Snoop Dogg; Anitta";";";3GRYbb9KX2iGeLMur4FUVs
Ventalation (feat. RJmrLA, $tupid Young & Azjah);";";"Snoop Dogg; RJMrLA; $tupid Young; Azjah";";";0AdQ4Fm7Z3Ehrz3imRdSUP
I Wanna Thank Me (feat. Marknoxx);";";"Snoop Dogg; Marknoxx";";";55VcwDNsQZcW8YBDudv9uS
Thank You Lord (Intro) [feat. Chris Bolton];";";"Snoop Dogg; Chris Bolton";";";3bXnUAy2HtlsHmVeyQ8k4Q
Love for God (feat. Uncle Chucc, The Zion Messengers & K-Ci);";";"Snoop Dogg; Uncle Chucc; The Zion Messengers; K-Ci";";";3Z5NT4c4itnolLk5DWW52Y
Defeated (feat. John P. Kee);";";"Snoop Dogg; John P. Kee";";";1LNUBHnbT6mG5P6MrlsJ2v
In the Name of Jesus (feat. October London);";";"Snoop Dogg; October London";";";3VxqaMNwboWEoQCeNMYPXl
Going Home (feat. Uncle Chucc & The Zion Messengers);";";"Snoop Dogg; Uncle Chucc; The Zion Messengers";";";6VdTz1RCyKTwwKPQKlKiCQ
Saved (feat. Faith Evans & 3rd Generation (Bereal Family));";";"Snoop Dogg; Faith Evans; 3rd Generation (Bereal Family)";";";1WPzLuZobA2iwQ8mcL7OoW
Sunshine Feel Good (feat. Kim Burrell);";";"Snoop Dogg; Kim Burrell";";";7Mw5RdOJKKhuxypP8GuPEj
Sunrise (feat. Sly Pyper);";";"Snoop Dogg; Sly Pyper";";";2sbGP8IRzU0kSCYbw8ERya
Pure Gold (feat. The Clark Sisters);";";"Snoop Dogg; The Clark Sisters";";";1WWkZKR5AvG4RGwwTyJGmA
Pain (feat. B Slade);";";"Snoop Dogg; B.Slade";";";7yDI1XwdDlEg7dwMqeHZwh
New Wave (feat. Mali Music);";";"Snoop Dogg; Mali Music";";";6INODoR55JNdWaOYGH97uV
On Time (feat. B Slade);";";"Snoop Dogg; B.Slade";";";58B5HpXA92KmAUJgeXN3rt
You (feat. Tye Tribbett);";";"Snoop Dogg; Tye Tribbett";";";5eD47cakdGoPPuvCQBhPeU
One More Day (feat. Charlie Wilson);";";"Snoop Dogg; Charlie Wilson";";";7FsNhRMjcNxNTfSTmftsZR
Bible of Love (Interlude) [feat. Lonny Bereal];";";"Snoop Dogg; Lonny Bereal";";";0qmDye81wDGBBGGlD7936J
Come as You Are (feat. Marvin Sapp & Mary Mary);";";"Snoop Dogg; Marvin Sapp; Mary Mary";";";4U71YbRASCEhxEqRcME4xq
Talk to God (feat. Mali Music & Kim Burrell);";";"Snoop Dogg; Mali Music; Kim Burrell";";";4XYfkBW3s0KyT77Gdfgbkd
Changed (feat. Isaac Carree & Jazze Pha);";";"Snoop Dogg; Isaac Carree; Jazze Pha";";";68avCGUOhQZ0IMh6et0aXV
Praise Him (feat. Soopafly);";";"Snoop Dogg; Soopafly";";";7jWQ4T9tMiZWge0GTUPvDX
Blessing Me Again (feat. Rance Allen);";";"Snoop Dogg; Rance Allen";";";6SAXC9KXj2dihEzSjDyqQB
Blessed & Highly Favored (Remix) [feat. The Clark Sisters];";";"Snoop Dogg; The Clark Sisters";";";1rDLwKD8TyWNMCfffIADRp
Unbelievable (feat. Ev3);";";"Snoop Dogg; Ev3";";";4e4cj10x0GgHuRUL38kWVW
No One Else (feat. K-Ci);";";"Snoop Dogg; K-Ci";";";3YJOdrVxrJGwMXnOPP4elx
Chizzle (feat. Sly Pyper & Daz Dillinger);";";"Snoop Dogg; Sly Pyper; Daz Dillinger";";";1D9QCwx24OHVKcQpxDvapV
My God (feat. James Wright);";";"Snoop Dogg; James Wright";";";3nZuZghTJwcw6099gvhWjz
When It's All Over (feat. Patti LaBelle);";";"Snoop Dogg; Patti LaBelle";";";66gQLJPstIw23s1QPyai7i
Crown (feat. Tyrell Urquhart, Jazze Pha & Issac Carree);";";"Snoop Dogg; Tyrell Urquhart; Jazze Pha; Isaac Carree";";";0zee27TblBVh4h9F5bOEGk
Call Him (feat. Fred Hammond);";";"Snoop Dogg; Fred Hammond";";";6DWqjssyDmLBl3Un9TSjrk
Change the World (feat. John P. Kee);";";"Snoop Dogg; John P. Kee";";";4hr1iPTcPqFNBvLUoHCELl
Words Are Few (feat. B Slade);";";"Snoop Dogg; B.Slade";";";3eMkfX408Bx5oOw6JraGV7
Everything (feat. Jacquees & Dreezy);";";"Snoop Dogg; Jacquees; Dreezy";";";2kY9Tk59g4BkLAZpd6kPEc
220 (feat. Goldie Loc);";";"Snoop Dogg; Goldie Loc";";";2WdQlmx03Vl51Wd8OiQy5U
Waves (feat. October London);";";"Snoop Dogg; October London";";";4Bka1GmAS5nRUkwYs1s0y9
I Don't Care (feat. LunchMoney Lewis);";";"Snoop Dogg; LunchMoney Lewis";";";14ECWudZinFYr2Mue5sy45
Doggytails (feat. Kokane);";";"Snoop Dogg; Kokane";";";67BPY7ijAvZR9xbn5YwF4u
Motivation (feat. Hypnotic Brass Essemble);";";"Snoop Dogg; Hypnotic Brass Essemble";";";0PBv2vCaLkWR9qnF2XkQdX
3's Company (feat. Chris Brown & O.T. Genasis);";";"Snoop Dogg; Chris Brown; O.T. Genasis";";";05S5yY7H0WuiQsEhrtjQj5
Dis Finna Be a Breeze! (feat. Ha Ha Davis);";";"Snoop Dogg; Ha Ha Davis";";";6H2HPlWDogZpr9lQdQeoYi
My Last Name (feat. October London);";";"Snoop Dogg; October London";";";0PCZZ8xvHdLaq9Jm0cVUR2
SportsCenter (Remix) (feat. DesignerFlow);";";"Snoop Dogg; DesignerFlow";";";1WRRIHdI4utvBEIsDkBV7h
Fly Away (feat. Shon Lawon);";";"Snoop Dogg; Shon Lawon";";";79xoG61JfCgbAQVfvHOS5o
Moment I Feared;";";"Snoop Dogg; Rick Rock";";";0NIOJPJfM7tAEcDfhqfrEI
Bacc in da Dayz;";";"Snoop Dogg; Big Tray Deee";";";7sjMS672QIyAyjFbvkxYI4
Trash Bags;";";"Snoop Dogg; K CAMP";";";1HAUtll1MUZmQaNE1XEDiU
Swivel;";";"Snoop Dogg; Stresmatic";";";6K8lKsm9m0Jaf4YlEfgf1q
Go On;";";"Snoop Dogg; October London";";";5GW97dX1VfhPhLvXyMGaSk
Toss It;";";"Snoop Dogg; Too $hort; Nef The Pharaoh";";";7bp82X8aj8BGFPrZpmnCED
420 (Blaze Up);";";"Snoop Dogg; Devin The Dude; Wiz Khalifa; DJ Battlecat";";";4hBy3nZVzQV4F3jxe1wWL1
Lavender (Nightfall Remix);";";"Snoop Dogg; BADBADNOTGOOD; KAYTRANADA";";";7emb4uOFqsVDNk92N7lK2e
Let Us Begin;";";"Snoop Dogg; KRS-One";";";4j4ryGgO5O5TTDtNWuK2lt
Mount Kushmore;";";"Snoop Dogg; Redman; Method Man; B-Real";";";1rV7Uaerzx6qwmhF89qfGL
Vapors (DJ Battlecat Remix);";";"Snoop Dogg; Charlie Wilson; Teena Marie";";";74akBDiqWQfVF7MWRSuhz8
Love Around the World;";";"Snoop Dogg; Big Bub";";";3CcxTpfAHrdBrogqGJ9t2s
Don't Stop (feat. Too Short);";";"Snoop Dogg; Too $hort";";";63GVZKTZBaODX3YKFurUdK
Let Me See Em Up (feat. Swizz Beatz);";";"Snoop Dogg; Swizz Beatz";";";47UwIpFdpauVx8Rs7lHqQt
Point Seen Money Gone (feat. Jeremih);";";"Snoop Dogg; Jeremih";";";2A5XwEJn9mEcGb6mf1RZWT
Oh Na Na (feat. Wiz Khalifa);";";"Snoop Dogg; Wiz Khalifa";";";5Rubvqk2z93BfeTpksMfq1
Affiliated (feat. Trick Trick);";";"Snoop Dogg; Trick Trick";";";7nwcW89tOUG3kauwPdvGaX
Light It Up (feat. Swizz Beatz);";";"Snoop Dogg; Swizz Beatz";";";2YC9xoAMR7ApyZk1SMG5ch
Kush Ups (feat. Wiz Khalifa);";";"Snoop Dogg; Wiz Khalifa";";";6F0C7tQO4QgvsHK4FDFVlE
Double Tap (feat. E-40 & Jazze Pha);";";"Snoop Dogg; E-40; Jazze Pha";";";7vWDbhuNqZpDBereSJjIRz
Let The Beat Drop (Celebrate) [feat. Swizz Beatz];";";"Snoop Dogg; Swizz Beatz";";";2zYjPB9XTrygyGRvDI3VJH
What If (feat. Suga Free);";";"Snoop Dogg; Suga Free";";";4bG7CYNxcVDvnr2i79gcZq
Revolution (feat. October London);";";"Snoop Dogg; October London";";";0wYLYZEJsUrrO6FvRrAjZi
Don't Stop (feat. Too Short);";";"Snoop Dogg; Too $hort";";";0qql5iQ1I00SLkLFqWYsxP
Let Me See Em Up (feat. Swizz Beatz);";";"Snoop Dogg; Swizz Beatz";";";5YxL3gBtqEWsvKAEBHFbSl
Point Seen Money Gone (feat. Jeremih);";";"Snoop Dogg; Jeremih";";";3yaRbA7QDf6ywnH0OKWJ5g
Oh Na Na (feat. Wiz Khalifa);";";"Snoop Dogg; Wiz Khalifa";";";5YrRDXMIKZABz3uyz66yiO
Affiliated (feat. Trick Trick);";";"Snoop Dogg; Trick Trick";";";6gasA4AYniyontUcCmK3nt
Light It Up (feat. Swizz Beatz);";";"Snoop Dogg; Swizz Beatz";";";0b2HGRcyVkIxdFvrAdvmDc
Kush Ups (feat. Wiz Khalifa);";";"Snoop Dogg; Wiz Khalifa";";";2DIK1fzAgXkZEzo5ClVaMA
Double Tap (feat. E-40 & Jazze Pha);";";"Snoop Dogg; E-40; Jazze Pha";";";4Es4b4HrV99G9FIO8j1aEx
Let The Beat Drop (Celebrate) (feat. Swizz Beatz);";";"Snoop Dogg; Swizz Beatz";";";7cXZBYK7LQ2SC6AQbLH6N5
What If (feat. Suga Free);";";"Snoop Dogg; Suga Free";";";0GwjUNxIjic6CnK0bLqsQS
Revolution (feat. October London);";";"Snoop Dogg; October London";";";3rdmPKsOz12h1zJbmLm0o4
Have U Eva;";";"Daz Dillinger; Snoop Dogg";";";6ckchQhQQ5dbfaPsRWAfV4
N My System;";";"Daz Dillinger; Snoop Dogg; DāM-FunK";";";4sRxkQCuyskBIwYvL5fBu3
Six n'da Morning;";";"Daz Dillinger; Snoop Dogg; Kurupt";";";1WnVkKzkch6ehaVCEmSN2K
Pop Pop Bang;";";"Daz Dillinger; Snoop Dogg";";";5IrBWOSIiesUP9mlBMt75i
Phenomonon;";";"Daz Dillinger; Snoop Dogg";";";11R0ku9j4dcXX1AQvGoNNJ
Happy Birthday;";";"Daz Dillinger; Snoop Dogg";";";0lK3CbgIK73Dem9i3t40e9
Dic Walk;";";"Daz Dillinger; Snoop Dogg; Kurupt";";";1ZOgiUuGbRrZCjkfFm07Qq
N My Life Tyme;";";"Daz Dillinger; Snoop Dogg; Kurupt";";";0INgLqE6OCDHuYz8XS5t6h
Bestfriend;";";"Daz Dillinger; Snoop Dogg";";";0FQSLIaT5MDr76vnJ5aEQ3
Sho You Right;";";"Daz Dillinger; Snoop Dogg; Shon Lawon";";";7mmN2YGTgkd5bPbp9y1IvQ
What's Yo Pleasure;";";"Daz Dillinger; Snoop Dogg";";";3lTaKO5i10aDBoCbF3y2py
It's Not a Secret;";";"Daz Dillinger; Snoop Dogg; Shon Lawon";";";54SE1jpVzt9DNKJXlzgJYb
Keep'a Nigga High;";";"Daz Dillinger; Snoop Dogg";";";5Rgfq410dDUY2SJre1OhRJ
We'll Miss U;";";"Daz Dillinger; Snoop Dogg";";";7FWMowJMz97hKEd9O74uGy
California Roll (feat. Stevie Wonder);";";"Snoop Dogg; Stevie Wonder";";";3wO19rAQ7aya5YFPQ6Ts0A
Peaches N Cream (feat. Charlie Wilson);";";"Snoop Dogg; Charlie Wilson";";";4lcpWCMFXNhvqNIQhB6yDv
Edibles (feat. T.I.);";";"Snoop Dogg; T.I.";";";26ZpMFioXWuHehA1bhU6Zc
Run Away (feat. Gwen Stefani);";";"Snoop Dogg; Gwen Stefani";";";3KntBFzQkMQtE0QejXNEcK
I'm Ya Dogg (feat. Kendrick Lamar & Rick Ross);";";"Snoop Dogg; Kendrick Lamar; Rick Ross";";";16utyJfWZGkTWYDobMzND7
Hit Da Pavement (Instrumental);";";"7 Days Of Funk; DāM-FunK; Snoop Dogg";";";2ibr0JhvWo6nCqTJK5JyRe
Let It Go (Instrumental);";";"7 Days Of Funk; DāM-FunK; Snoop Dogg";";";0DHFZCJsmROhQM7oCf4k5x
Faden Away (Instrumental);";";"7 Days Of Funk; DāM-FunK; Snoop Dogg";";";370bQESxpdp7KMsI1mp8MD
1Question (Instrumental);";";"7 Days Of Funk; DāM-FunK; Snoop Dogg";";";0gzfYdNbNrR0sXRmd5UT4q
Ride (Instrumental);";";"7 Days Of Funk; DāM-FunK; Snoop Dogg";";";4tHDo0IIzJ4wcwQ1KksrNU
Do My Thang (Instrumental);";";"7 Days Of Funk; DāM-FunK; Snoop Dogg";";";3hz3LWMRdiPHqPUeuJn1Wi
I'll Be There 4U (Instrumental);";";"7 Days Of Funk; DāM-FunK; Snoop Dogg";";";5DNF3ffPkB0PJZNQ4R0Czj
Systamatic (Instrumental - Bonus Track);";";"7 Days Of Funk; DāM-FunK; Snoop Dogg";";";62FHMZuvZES2KZYzdsbADN
High Wit Me (Instrumental - Bonus Track);";";"7 Days Of Funk; DāM-FunK; Snoop Dogg";";";4HTnD69PJaOyvuKcyMVGYp
Wingz (Instrumental - Bonus Track);";";"7 Days Of Funk; DāM-FunK; Snoop Dogg";";";1Lc74JH1jh6HGeZ0EXHNYD
1Question?;";";"7 Days Of Funk; Steve Arrington";";";1frfku11A0BgmSWf7sTf2l
Ride;";";"7 Days Of Funk; Kurupt";";";5qhAkSkJdQr7IMkmFxPXVx
Systamatic (Bonus Track);";";"7 Days Of Funk; Tha Dogg Pound";";";3F4c4Vi48WTMfnLSenUdBf
Toyz N Da Hood;";";"Snoop Dogg; Bootsy Collins";";";4pW69VGNMBldLloHQzml3h
My Own Way;";";"Snoop Dogg; Denaun";";";6tHZlChXjnR4JiYSoZLLkk
Wonder What It Do;";";"Snoop Dogg; Uncle Chucc";";";2sjBXUObF3SbgucLsZrGzw
My Fucn House;";";"Snoop Dogg; E-40; Young Geezy";";";2AX9DgPh3rly8amlkAbTeB
Peer Pressure;";";"Snoop Dogg; Traci Nelson";";";6LkFo3HO985S4fVPGLY1aW
I Don't Need No Bitch;";";"Snoop Dogg; Devin The Dude; Kobe Honeycutt";";";5PvZg5UY5b6vSL4igLAOOn
Platinum;";";"Snoop Dogg; R. Kelly";";";2uswI6qTF0wucOjbkeGfx0
Boom;";";"Snoop Dogg; T-Pain";";";5BAQaMRd8ty7q1N1xVssZZ
We Rest N Cali;";";"Snoop Dogg; Bootsy Collins; Goldie Loc";";";7cCpPayrad2Bo3ssghKVQq
El Lay;";";"Snoop Dogg; Marty James";";";4HKU86hF8aWls44PqUN6Ze
Gang Bang Rookie;";";"Snoop Dogg; Pilot";";";3UKJybOsphGlYpFdPcc01X
This Weed Iz Mine;";";"Snoop Dogg; Wiz Khalifa";";";7v6G5OM3X0o897asIT0YE6
Take U Home;";";"Snoop Dogg; Too $hort; Daz; Kokane";";";5tO38c8WGdmofNLkdRleEr
Sumthin Like This Night;";";"Snoop Dogg; Gorillaz";";";5UNeLR6A21P9b3WNjDvhOU
Superman;";";"Snoop Dogg; Willie Nelson";";";5jcQZOQpMWFraXxn9hAQt0
Eyez Closed;";";"Snoop Dogg; Kanye West; John Legend";";";618SCcvs6hddN0W5ArmQnQ
Cold Game;";";"Snoop Dogg; LaToiya Williams";";";61b9ZPYn9vGtE4BO5OW55v
Wet - Remix;";";"Snoop Dogg; David Guetta";";";2alijxLnR0RCiJ5JvzhDuT
I Wanna Rock;";";"Snoop Dogg; JAY-Z";";";0uqGXycobxJaUqe8bkuhLq
So Gangsta;";";"Snoop Dogg; Butch Cassidy";";";6a0Wr4E1DhBF9RFfo5eQyy
That Tree;";";"Snoop Dogg; Kid Cudi";";";4HC13oxSHOqA092lFbRnyW
Pronto;";";"Snoop Dogg; Bun B; Soulja Boy";";";3mO24qgjaeHaMfYZwjlDtf
Gangsta Luv;";";"Snoop Dogg; The-Dream";";";5q1tV7PxaRA2Wrl6lbonmA
Doggystyle;";";"Snoop Dogg; George Clinton; Jewell";";";4wPuIAVj35hwmdDxdOkCrn
Hoez;";";"Snoop Dogg; Tha Dogg Pound";";";2Y0y4nYTgVcfN4qEqcULfw
O.G.;";";"Snoop Dogg; Nate Dogg";";";22Cz5GnNyU3yYpTPImPpta
One Life To Live;";";"Snoop Dogg; Technic; The Lady Of Rage";";";3jKGp6b6BKkXdZGr9Rnrs0
The Genie;";";"Snoop Dogg; Bad Azz; Bo-Rock";";";2Wqv4Peov0GGOMVLR1qja3
Funk Wit Ya Brain;";";"Snoop Dogg; Mahallia Franklin; K.V";";";50mrQawSkxxwBJzauvGcKZ
Caught Up;";";"Snoop Dogg; Charlie Wilson";";";1X7inBkFRn19mTePx06ek0
Gravy Train;";";"Snoop Dogg; Big Tray Deee; Bad Azz";";";7uwvMMVdD3rMNW3sTFRcvO
Life’s Hard (Dedication For 2pac);";";"Snoop Dogg; K-Ci & JoJo; Big Pimpin";";";6TGJF4fXCWRi3cB6pGToE9
The Root Of All Evil;";";"Snoop Dogg; Teena Marie";";";7smZyGM92Mhb4N7aVHC2hS
1800;";";"Snoop Dogg; Lil Jon";";";1U90lN66HMHdsAGqMR6QLM
Different Languages;";";"Snoop Dogg; Jazmine Sullivan";";";4JTY6b275EkStcfBb9EqAC
Gangsta Luv;";";"Snoop Dogg; The-Dream";";";1E8wif6bVXurUgxV8Gfwrw
Pronto;";";"Snoop Dogg; Soulja Boy";";";4UbJGBZUZGAfkgnUSxZw11
Upside Down;";";"Snoop Dogg; Nipsey Hussle; Problem";";";4ruc7Nwc3AIIt7oPqnYMHS
Secrets;";";"Snoop Dogg; Kokane";";";55tKKZIbdZ7Vs4FfFkIix7
Pimpin Ain't EZ;";";"Snoop Dogg; R. Kelly";";";39y8XCFwnGnYXov4dQlaFa
Luv Drunk;";";"Snoop Dogg; The-Dream";";";0otKlNtPM5i5Pzv9bWsGFp
Special;";";"Snoop Dogg; Brandy; Pharrell Williams";";";74z465KvfBQrAqovUVLkpo
Life Of Da Party;";";"Snoop Dogg; Too $hort; Mistah F.A.B.";";";7bZZOib08UAQcw9UJgNjfv
Waste Of Time;";";"Snoop Dogg; Raphael Saadiq";";";4IvWl4lzID4wgNU3yjIgIa
Can't Say Goodbye;";";"Snoop Dogg; Charlie Wilson";";";4TyGYTAexVaiTD9nr2ipkt
Get It Cuz I Want It;";";"Snoop Dogg; JT The Bigga Figga; Luciano; Dimez";";";46hcws0kXZaiQAV5F53TQx
Half-A-Brik;";";"Snoop Dogg; JT The Bigga Figga; Tae Natti";";";78O6hPup7qUH9WwKpAqfq7
Homicide;";";"Snoop Dogg; JT The Bigga Figga";";";65xmhlIvBrKGYKzI303ezp
Don't Ask Me;";";"Snoop Dogg; JT The Bigga Figga";";";3ZH8mOpKwvN0P1wEbZubuX
Boss;";";"Snoop Dogg; JT The Bigga Figga";";";6bR14ZyHZ5YaateeZ8nSVm
Independent in the Game;";";"Snoop Dogg; JT The Bigga Figga";";";26CA8ndkJGaLpe1zk1TAe7
Gotta Get This Money;";";"Snoop Dogg; JT The Bigga Figga";";";7h5YlfpT6yXggNomPSHidq
Bring It Back;";";"Snoop Dogg; JT The Bigga Figga";";";2QlRtTxUVcWlk34gOUip6y
What You Know About It;";";"Snoop Dogg; JT The Bigga Figga; Young Noble";";";7ySbBN60guFfB45DiqMcsB
Family Tree;";";"Snoop Dogg; JT The Bigga Figga; The So Hood Family";";";6p1rKNpu7pwuDuBHJj4jHC
The Life in California;";";"Snoop Dogg; JT The Bigga Figga; G-Bundle; Lord Nez";";";0zsnCEaf8k32qJ0qTCSCHu
Been Hustlin;";";"Snoop Dogg; JT The Bigga Figga";";";4AjyK4cOWdbhFbiXaQFQ6s
I'm About That;";";"Snoop Dogg; JT The Bigga Figga";";";0MWNrKmXLb4DDYynOGxSZe
Addiction;";";"Snoop Dogg; JT The Bigga Figga";";";00GQOdQHs6euBVz5pdavWa
A Boss Like Me;";";"Snoop Dogg; JT The Bigga Figga; Outlawz; Skrillz; Streetz";";";3HU4kfXbCrEZBfZ0cmojEp
Ride for the Cause;";";"Snoop Dogg; JT The Bigga Figga; Outlawz";";";7pK6OLM326RvXzd9CfZl8i
Intrology;";";"Snoop Dogg; George Clinton";";";4YCrejiod7RUjLJisHhiiA
Crazy;";";"Snoop Dogg; Nate Dogg";";";2jbYDQRvqcwW9zpQ9vopXZ
Vato;";";"Snoop Dogg; B-Real";";";2TgPHDU8zPgAvkSLXkHKXR
That's That Shit;";";"Snoop Dogg; R. Kelly";";";41sLy8IQUSgvjjeW2CN0vc
Candy (Drippin' Like Water) - Final Album Version (Explicit);";";"Snoop Dogg; E-40; MC Eiht; Goldie Loc; Daz; Kurupt";";";0E1NCpOWUweGB674Hhu7sc
Get A Light;";";"Snoop Dogg; Damian Marley";";";0brst8Eu2TRY13cwTQMcQc
Gangbangin' 101;";";"Snoop Dogg; The Game";";";2E2A3BY5Zp4vTCtWIKMxPG
Boss' Life;";";"Snoop Dogg; Akon";";";4UprL40OVADveANAtCNrIa
LAX;";";"Snoop Dogg; Ice Cube";";";5e8ER5Aot7za1AzhnvtiiZ
Like This;";";"Snoop Dogg; Western Union; LaToiya Williams; Raul Miaon";";";2mcOx4WV3guTbYOEiHZfqq
Which One Of You;";";"Snoop Dogg; Nine Inch Dix";";";6Io4X6tBCXMi5pXve3MV5X
I Wanna Fuck You;";";"Snoop Dogg; Akon";";";1G93i9ga7ZPEOqpiNhM1mq
Psst!;";";"Snoop Dogg; Jamie Foxx";";";0mFp3ZSck3qZjbGNBfvpkz
Don't Stop;";";"Snoop Dogg; War Zone; Kurupt";";";6GgSHVI05HgDFAiIxRDawY
Imagine;";";"Snoop Dogg; Dr. Dre; D'Angelo";";";0FNPiAAdWdWaGr7JOnlKmi
Conversations;";";"Snoop Dogg; Stevie Wonder";";";5KzKsgQrMPsM7oBumXej5s
Sisters N Brothers;";";"Snoop Dogg; Max B";";";5le8OFswuYUU4VAYMKlqy3
Just The Way You Like It;";";"Snoop Dogg; Lil Wayne";";";520zAI6RvGhDHsafAuBzYl
Remember Me;";";"Snoop Dogg; Rell";";";5jJu9mnARKq8q6PyLwIOUg
Real Soon;";";"Snoop Dogg; Hell Rell";";";066G7ir7EUcYilkqogdyIX
Can't Find My Panties;";";"Snoop Dogg; Max B";";";6ULiOPndKWvKjdObgIlG5m
If;";";"Snoop Dogg; Max B";";";0H3BDDAbQej2icUgcqXGBN
Drop It Like It's Hot;";";"Snoop Dogg; Pharrell Williams";";";2NBQmPrOEEjA8VbeWOQGxO
Can I Get A Flicc Witchu;";";"Snoop Dogg; Bootsy Collins";";";48q2viCPz7CaxAxatvZgKp
Ups & Downs - Album Version (Explicit) w/o interlude;";";"Snoop Dogg; Bee Gees";";";6dw5cCtf3KtRNauKUERzR2
Step Yo Game Up;";";"Snoop Dogg; Lil Jon; Trina";";";0bdDOIHKeACiHrLYzY3YJt
Perfect;";";"Snoop Dogg; Charlie Wilson";";";0tBK7YV0UMWiqc8UFd6eT4
Oh No - Album Version (Explicit) w/o interlude;";";"Snoop Dogg; 50 Cent";";";6eMASdR1peGlkxKcPDxNgO
Can You Control Yo Hoe;";";"Snoop Dogg; Soopafly";";";5wXrQgeZtaMoA7ZWgPDsPn
Signs;";";"Snoop Dogg; Charlie Wilson; Justin Timberlake";";";4HSAJpNocVNJbwbQvtCMdO
I'm Threw Witchu;";";"Snoop Dogg; Soopafly";";";3Lr4MGE2NDUjlq1qi99TSR
Girl Like U;";";"Snoop Dogg; Nelly";";";5qf8hsPoCJpP1xod7Vzpac
No Thang On Me;";";"Snoop Dogg; Bootsy Collins";";";6JYUZ14W9IgEC1wRny2I8k
From Tha Chuuuch To Da Palace;";";"Snoop Dogg; Pharrell Williams";";";5M3fIM8TMpZtLC5yHc98Rh
I Believe In You;";";"Snoop Dogg; LaToiya Williams";";";084bko3tuMnppG1yJBsPCO
Lollipop;";";"Snoop Dogg; JAY-Z; Nate Dogg";";";2A1i5Z8ecTmWpbQgsEyRx3
Ballin';";";"Snoop Dogg; Lil 1/2 Dead; The Dramatics";";";4zNJc0q6w9XE8gXmbeFMls
Beautiful;";";"Snoop Dogg; Pharrell Williams; Charlie Wilson";";";7FrJV8tydWEv1Mxu2mIQrm
Paper'd Up;";";"Snoop Dogg; Kokane; Traci Nelson; Mr.Kane";";";4ZQOGd1cjahGnvo6d6ANkd
Bo$$ Playa;";";"Snoop Dogg; Arch Bishop Don Magic Juan";";";0eF9nbzuz4htaxaMWAjxuB
Hourglass;";";"Snoop Dogg; Goldie Loc; Kokane";";";1iTbR8bmAiUMyZSgtGXudI
I Miss That Bitch;";";"Snoop Dogg; E-White";";";2moW3CKng8WJ2PXkzFf3rb
From Long Beach 2 Brick City;";";"Snoop Dogg; Warren G; Redman; Nate Dogg";";";3TPoOLzqJLYnB2VnDudO7C
You Got What I Want;";";"Snoop Dogg; Goldie Loc; Ludacris; Charlie Wilson";";";3KAIypz76ZvPmVLYPcRAnb
Batman And Robin;";";"Snoop Dogg; The Lady Of Rage; RBX";";";0zdcKlp8JvkHXFda6GMOmd
Hennesey N Buddah;";";"Snoop Dogg; Kokane";";";6dqE95KU5yVcqDkgEt3TIm
True Lies;";";"Snoop Dogg; Kokane";";";0qhl7BtMawSDEJ06bVIrL5
Go Away;";";"Snoop Dogg; Kokane";";";63AOur1ZdTFZ6Nzox6jjNr
Set It Off;";";"Snoop Dogg; MC Ren; The Lady Of Rage; Nate Dogg; Ice Cube";";";7E6cKQcGpPqsr3eqnpnw0C
Stacey Adams;";";"Snoop Dogg; Kokane";";";2Gu5SaXstpHraItPqNVOSV
