Nome da Música;Artistas;ID da Música
Rounds (feat. Rick Ross);";";"John Legend; Rick Ross";";";2AeVYIAQH6qdsUMg3ggLMC
Dope (feat. JID);";";"John Legend; JID";";";3VEL2iEZ8udM0evRe3Bj2u
Strawberry Blush (feat. Free Nationals);";";"John Legend; Free Nationals";";";7wIZ3CXR08DPLR8G0uk210
Splash (feat. Jhené Aiko & Ty Dolla $ign);";";"John Legend; Jhené Aiko; Ty Dolla $ign";";";5Ip2VxpYt1dCD7MKmjrw52
Fate (feat. Amber Mark);";";"John Legend; Amber Mark";";";5ARNp5KHWr4CW8icZuOtSg
Love (feat. Jazmine Sullivan);";";"John Legend; Jazmine Sullivan";";";2K5CdJb1IkAlsT108wRxYP
All She Wanna Do (with Saweetie);";";"John Legend; Saweetie";";";4dfotX3ZuHDqwbXFs6QBgy
Honey (with Muni Long);";";"John Legend; Muni Long";";";1ei5bZDXeMNU4rw3iEQ2zX
Speak In Tongues (feat. Jada Kingdom);";";"John Legend; Jada Kingdom";";";5lTXNKX4OVCSBKHBkSodzs
The Other Ones (feat. Rapsody);";";"John Legend; Rapsody";";";0u48wTfTCL8z1hVgrnthzh
Good (feat. Ledisi);";";"John Legend; Ledisi";";";2ddFDHABZYvXK6V4zWpH1g
Wild (feat. Gary Clark Jr.);";";"John Legend; Gary Clark Jr.";";";4rVW6XqAsSaf5vOwc8FREW
U Move, I Move (feat. Jhene Aiko);";";"John Legend; Jhené Aiko";";";7wfDCDfhVe2tFxIkQEJp35
Don't Walk Away (feat. Koffee);";";"John Legend; Koffee";";";2A6BUUkV6TgT4QdLCXIDPl
Remember Us (feat. Rapsody);";";"John Legend; Rapsody";";";3vS7px4CSV1I8hP5MXEdk8
I'm Ready (feat. Camper);";";"John Legend; Camper";";";3o6hX5T3imF508VycE44lQ
What Christmas Means to Me (feat. Stevie Wonder);";";"John Legend; Stevie Wonder";";";4YzayQhtm0lFenr0qVLbUy
Baby, It's Cold Outside (feat. Kelly Clarkson);";";"John Legend; Kelly Clarkson";";";4HC7ohixFIg0WB2q9rJCfm
Have Yourself a Merry Little Christmas (feat. Esperanza Spalding);";";"John Legend; Esperanza Spalding";";";6WsrFdZAKUCFpTUOIZJ8su
It Don't Have to Change (feat. The Stephens Family);";";"John Legend; The Stephens Family";";";4hBdVqiwLUtDcLl8cxqOX6
What Christmas Means to Me (feat. Stevie Wonder) - Karaoke/TV;";";"John Legend; Stevie Wonder";";";6mRJTD5JztIF73ahTEb4pM
Baby, It's Cold Outside (feat. Kelly Clarkson) - Karaoke/TV;";";"John Legend; Kelly Clarkson";";";1w6QXLYct9xE8EfxKDCSCM
What Christmas Means to Me (feat. Stevie Wonder) - Instrumental;";";"John Legend; Stevie Wonder";";";7gnd1nPIiW1c6OYqCxLcAT
Baby, It's Cold Outside (feat. Kelly Clarkson) - Instrumental;";";"John Legend; Kelly Clarkson";";";7djNrXv91RKRcRNzfUozhY
Have Yourself a Merry Little Christmas (feat. Esperanza Spalding) - Instrumental;";";"John Legend; Esperanza Spalding";";";3bb4dMaHmeoE4Zel1ypQca
What Christmas Means to Me (feat. Stevie Wonder);";";"John Legend; Stevie Wonder";";";4hnzXzE7JiU5QAZFF9OUsI
Baby, It's Cold Outside (feat. Kelly Clarkson);";";"John Legend; Kelly Clarkson";";";0cBCE4fJztY5LcB6P7P2io
Have Yourself a Merry Little Christmas (feat. Esperanza Spalding);";";"John Legend; Esperanza Spalding";";";4qhQY0Bz27cHyRZqlDkpze
Penthouse Floor (feat. Chance the Rapper);";";"John Legend; Chance the Rapper";";";67Nf4Nsr2Nm5CFfJgqwDb0
Darkness and Light (feat. Brittany Howard);";";"John Legend; Brittany Howard";";";4jBPWUAtvIbj7trXEg9QPJ
Overload (feat. Miguel);";";"John Legend; Miguel";";";37exBefsiwr3rmQ7xcQnEJ
Who Do We Think We Are (feat. Rick Ross);";";"John Legend; Rick Ross";";";2scd9lw4ljzDwMfG3WW4gD
Angel (Interlude) (feat. Stacy Barthe);";";"John Legend; Stacy Barthe";";";7tJRs2UPalK0XWwkQ4e73I
We Loved It (feat. Seal);";";"John Legend; Seal";";";6FmEVOQProbemD1POcFZji
Hard Times (feat. Black Thought);";";"John Legend; The Roots; Black Thought";";";6Ty9r1U9uSSGg4MQ2SVeRq
Compared to What;";";"John Legend; The Roots";";";6HwUwxon7QjBIf75SCz2QD
Wake up Everybody (feat. Common & Melanie Fiona);";";"John Legend; The Roots; Common; Melanie Fiona";";";7lVxWMH0C3Bj8b8JLkh9EN
Our Generation (The Hope of the World) (feat. C.L. Smooth);";";"John Legend; The Roots; C.L. Smooth";";";3meu5pk3FlHaYFg7KFHKhT
Little Ghetto Boy (Prelude) (feat. Malik Yusef);";";"John Legend; The Roots; Malik Yusef";";";2WhjynOaEluqSAFRXmsoZi
Little Ghetto Boy (feat. Black Thought);";";"John Legend; The Roots; Black Thought";";";3ugvKbyrqGfq4eLRI2VXSN
Hang on in There;";";"John Legend; The Roots";";";5jklyYwzYIY20CiWG5uccu
Humanity (Love the Way It Should Be);";";"John Legend; The Roots";";";6eXNZLPoIikMlKuo1lKBAa
Wholy Holy;";";"John Legend; The Roots";";";6Y61YHqGY7SNGOHqlOwyBu
I Can't Write Left Handed;";";"John Legend; The Roots";";";7vNqOnzzvwWoBXnKhrTZCM
I Wish I Knew How It Would Feel to Be Free;";";"John Legend; The Roots";";";7CgMPXH1C0YesTnFl3zUlx
Shine;";";"John Legend; The Roots";";";72EpZIUOksNX1nI28s7tDi
Green Light (feat. André 3000);";";"John Legend; André 3000";";";72by3Re4C3eVEBXvsUo0zV
It's Over (feat. Kanye West);";";"John Legend; Kanye West";";";4QIB7ovBhGBfLF0WsUTlwb
Quickly (feat. Brandy);";";"John Legend; Brandy";";";1U0OMWvR89Cm20vCNar50f
No Other Love (feat. Estelle);";";"John Legend; Estelle";";";0FsqhyyHNZJfK29IpHihMK
King & Queen (feat. Mary J. Blige);";";"John Legend; Mary J. Blige";";";5jVjKCGYUvnikPZJ4BQuVD
Number One (feat. Kanye West);";";"John Legend; Kanye West";";";3zQGmJ4k3JeqwAjfrEcwHp
I Can Change (feat. Snoop Dogg);";";"John Legend; Snoop Dogg";";";4xFfDqhvO8Xkl60MmlvzaC
It Don't Have to Change (feat. The Stephens Family);";";"John Legend; The Stephens Family";";";3e1PfBYUcfikMd2oyhBKKl
Live It Up;";";"John Legend; Miri Ben-Ari";";";4v7GPlf49Mki23eSh3XXwd
So High (feat. Lauryn Hill) - Cloud 9 Remix;";";"John Legend; Ms. Lauryn Hill";";";5z1c8qT3KezxqDK043lglc
The Show (with John Legend);";";"Niall Horan; John Legend";";";2TWy04y2MWjwEZ73SnaFAF
Heading for Home (feat. John Legend);";";"Rufus Wainwright; John Legend";";";1OqrPoM4GZSTG5LQe8aqAO
Down in the Willow Garden (feat. Brandi Carlile);";";"Rufus Wainwright; Brandi Carlile";";";4kO3kFegr705BFGpZ4wuP8
All She Wanna Do (feat. Saweetie) [NIIKO X SWAE Remix];";";"John Legend; NIIKO X SWAE; Saweetie";";";7y1sT9jbQ9IZy3g6b55Ptq
Nervous - Xan Griffin Remix;";";"John Legend; Xan Griffin";";";1p3zbNomnDwqTREj5HCGpR
Nervous - Prince Fox Remix;";";"John Legend; Prince Fox";";";3MZl2L2vVj57RN5KuckhYT
Nervous - King Britt Sexytech Remix;";";"John Legend; King Britt";";";3ZzllkUOqTyjvFNLVUCKIU
Nervous - Remix;";";"John Legend; Sebastian Yatra";";";5lVvaCKARxKTJXZIWgzo6c
All She Wanna Do (with Saweetie);";";"John Legend; Saweetie";";";0yq6siEu8dMBv2sb8yEtEJ
Honey (with Muni Long);";";"John Legend; Muni Long";";";5C93HMg6JWdTey2P717Ozq
Dope (with JID);";";"John Legend; JID";";";3E1y4V7dxcn5AwKCD4AqFn
Tacones Rojos - With John Legend;";";"Sebastian Yatra; John Legend";";";7pCcX8GklrbASun9rWFh4W
Tomorrow;";";"John Legend; Florian Picasso; Nas";";";2F8UhXCxJveJWAmUVKse5h
In My Mind - Majestic Remix;";";"Alok; John Legend; Majestic";";";0BnQFAuo7kRQ5zrkgHg7mj
In My Mind - Joel Corry Remix;";";"Alok; John Legend; Joel Corry";";";1a9KwVksNb6cvMy2csbruU
In My Mind - Dubdogz Remix;";";"Alok; John Legend; Dubdogz";";";33Dtz6RK9uiMNinuL2wbti
The Christmas Song (Chestnuts Roasting On An Open Fire) (duet with John Legend);";";"Nat King Cole; John Legend";";";1O9ML3Bv8XvQ3xWUVL0jj7
In My Mind;";";"Alok; John Legend";";";4JUjUe1zor1myq8f2eq3Kq
Someday We’ll All Be Free - The Voice Performance;";";"Victor Solomon; John Legend";";";27sIhOqivXY4wm07W5HAm2
Minefields - Live Acoustic;";";"Faouzia; John Legend";";";1C2o1BM7TI9uzQTvWrFU7h
Minefields;";";"Faouzia; John Legend";";";34adm4Rlc4Ntrnqrj7xb5A
Minefields - Ofenbach Remix;";";"Faouzia; John Legend; Ofenbach";";";1wHDuNAl1QJ78xLgaXYVJo
Minefields - Hook N Sling Remix;";";"Faouzia; John Legend; Hook N Sling";";";1PyEYKtDtnpbRr6fpgTaL3
Minefields - Hook N Sling Remix;";";"Faouzia; John Legend; Hook N Sling";";";2Kcre3WEvIWTDIDYadE5VQ
Minefields - Ofenbach Remix;";";"Faouzia; John Legend; Ofenbach";";";5ma5cqNZGiJonJNYCa96Ci
Minefields;";";"Faouzia; John Legend";";";2pRPvlZzNwl8KhJybrEbmb
Minefields;";";"Faouzia; John Legend";";";1OU4E4HiVjdak0mL4blVWT
Wild - MEDUZA Remix;";";"John Legend; MEDUZA";";";0eHT54ehADNQkSypa0YGgp
Bigger Love - Remix;";";"John Legend; Mau y Ricky";";";5lBPTs70Ep45LLpWNlkipA
Drown;";";"Lecrae; John Legend";";";5tLPWQUcUHvR8kRr8k33cl
Rocket Man - The Voice Performance;";";"CammWess; John Legend";";";4a6h3CHzQsWJpuKvFn0Aeq
Memories;";";"Buju Banton; John Legend";";";4b740RnLWsvdqaxUbuvwFO
Last Time I Say Sorry;";";"Kane Brown; John Legend";";";3gAaDDoBipWZzGBMwK194e
Quisiera;";";"Flor de Toloache; John Legend; Cultura Profética";";";7v0WvqGq7auy99Nydgc6YJ
Conversations in the Dark - Violin Remix;";";"John Legend; Lindsey Stirling";";";6ujkVvJAlQ39Ra0E2tKx8M
All of Me - Violin Remix;";";"John Legend; Lindsey Stirling";";";2MQOe9dID5bAVkKmoRcH8M
Conversations in the Dark - John Legend vs. David Guetta;";";"John Legend; David Guetta";";";20d27F17AZOxTJOEHAVK2Y
Higher (feat. Nipsey Hussle & John Legend);";";"DJ Khaled; Nipsey Hussle; John Legend";";";62jiUv5B0Ps4E1s6lAzYyr
Glory (From the Motion Picture Selma);";";"Common; John Legend";";";2fmqPLRFdJNPhLU3b2NSFp
You & I (Nobody in the World) - R3hab Remix - Radio Edit;";";"John Legend; R3HAB";";";738J023eio9C4ViccIAQnD
A Place Called World (feat. Dan Croll, Nach & Anni B Sweet) - The Zombie Kids Remix - Radio Edit;";";"John Legend; Dan Croll; Nach; Anni B Sweet; The Zombie Kids";";";0xVvxSAV5pd9xT81CpU9bq
A Place Called World (feat. Dan Croll, Nach & Anni B Sweet) - The Zombie Kids Remix - Extended Mix;";";"John Legend; Dan Croll; Nach; Anni B Sweet; The Zombie Kids";";";1bz6CXId4wruFk5gQAD67b
A Place Called World (feat. Dan Croll, Nach & Anni B Sweet);";";"John Legend; Dan Croll; Nach; Anni B Sweet";";";63jyG9Xo6zVZUi6JoCY9ex
All of Me (feat. Jennifer Nettles & Hunter Hayes);";";"John Legend; Jennifer Nettles; Hunter Hayes";";";0vaLIgHcJM3Fs3jxN9MxPm
All of Me - Tiësto's Birthday Treatment Remix - Radio Edit;";";"John Legend; Jason Agel; Tiësto";";";1mzGywacjpeik00PVLBPpF
Made to Love - Benny Benassi Remix;";";"John Legend; Marco Benassi; Alessandro Benassi";";";6d684kttttORu9BxJI0wCC
Made to Love - Friend Within Remix;";";"John Legend; Friend Within";";";5DInP8u1lWJDO43rD9qLAB
When Christmas Comes;";";"Mariah Carey; John Legend";";";6b8iHadB73UYCVyXLaFedK
Wake Up - Cover of Arcade Fire Song;";";"John Legend; The Roots";";";2QmqDBomh1vNVHLGHQToHy
Wake Up Everybody - Truth&Soul Remix;";";"John Legend; The Roots; Jeff Dynamite";";";655TkpntV7NFe2kquxesl6
No Other Love (feat. Estelle);";";"John Legend; Estelle";";";2RjfhUVfgwqC2QIGZtnRur
No Other Love (feat. Estelle) - Di Genius Remix;";";"John Legend; Estelle; Stephen ""Di Genius"" McGregor";";";64zUZE0bquJMz9Q8ra4PZt
No Other Love (feat. Estelle) - Curtis Lynch Remix;";";"John Legend; Estelle; Curtis Lynch Jnr";";";76mmi47RZkDPohQLQB4KDr
No Other Love (feat. Estelle) - Jus Bus Remix;";";"John Legend; Estelle; Justin ""Jusbus"" Nation";";";2p5xkyGfGzZZy99PnDIYfS
Can't Be My Lover (feat. Buju Banton);";";"John Legend; Buju Banton";";";5DqUD0FJORNFpbs6dsbUNn
Can't Be My Lover (feat. Buju Banton) - Curtis Lynch Remix;";";"John Legend; Buju Banton; Curtis Lynch Jnr";";";20jlpY83jcnJcyecYVory3
Green Light (feat. André 3000) - International Radio Edit;";";"John Legend; André 3000";";";0X1nt7HNspAp9IcuKffv7W
Green Light (feat. André 3000) - Johnny Douglas Radio Edit;";";"John Legend; André 3000; Johnny Douglas";";";4epRNysN1dYq7vrSkuIpR2
Green Light (feat. André 3000) - Radio Edit;";";"John Legend; André 3000";";";6XszxzqdtjtVOFmPo0zLAH
Green Light (feat. André 3000);";";"John Legend; André 3000";";";59RTLaPw8SpAuQDzNyYpxT
Green Light (feat. André 3000);";";"John Legend; André 3000";";";19sBLZ3pyqFj5lq9KpS61F
Heaven (feat. Pusha T) - Remix;";";"John Legend; Pusha T";";";3yAzxWH5g74F37ry6UCHQO
Heaven (feat. Pusha T) - Remix;";";"John Legend; Pusha T";";";317DyUwUEDoHV3AJILnMVD
Heaven (feat. Pusha T) - A Cappella;";";"John Legend; Pusha T";";";3MgUWXXlvgUqXYHVws2EIW
Number One (feat. Kanye West);";";"John Legend; Kanye West";";";3No7jPmOfOWfzvZrDkb1jp
Number One (feat. Kanye West);";";"John Legend; Kanye West";";";2uGG5acX5Wq2vLtG5ugX3s
Selfish;";";"Slum Village; John Legend; Kanye West";";";3Z3Fs0QhlvrJVRBHwzAFnQ
